sentence_id	sentence	sentence_domain	source
d496beb7bb0f8b1278cdb66589deb68032395688724561f9519a7faf7c608a9a	সাৰে থকা গোটেই সময়খিনি, মুখ বা গা ধোৱা সময়কণ বাদ দি।		http://www.xahitya.org/2019/09/22/%e0%a6%b6%e0%a6%bf%e0%a6%b6%e0%a7%81%e0%a7%b0-%e0%a6%ae%e0%a6%be%e0%a6%af%e0%a6%bc%e0%a6%aa%e0%a6%bf%e0%a6%af%e0%a6%bc%e0%a6%be-%e0%a6%a1%e0%a6%be%e0%a6%83-%e0%a6%95%e0%a7%81%e0%a6%ae/
d4a029406ec7603864963086085a5bb1535ea3d08a1bf99d2650a2434d46ad31	???? ??????? ???? ??? ???????? ???? ????? ???????? ??? ???? ???????? ??????? ?????? ???		Alcohol and Narcotics Free Assam
d4bb17dcf123ab62fc15be1d8aa4e3da1aec9f9cf1b7057f6f0be3f074ecf4e9	গতিকে অসমীয়া পৰম্পৰাগত আহাৰত এইবিলাক মচলাৰ ব্যৱহাৰ নাই।		Assamese Wikipedia Articles
d4c0641d57a43f72eaf24c78e8f561d96498cd33b39c8008214d5b34eb621c3a	ব্ৰহ্মপুত্ৰ নদীখন অসমৰ প্ৰায় সোঁমাজেৰে বৈ গৈছে।		স্ৱ-উদ্ধৃতি 
d4ce6c24ba1c47587f2d5ea5c32d8b134956557989d7ef8a6be01b4704a4b90c	আৰজিবি কীব’ৰ্ড	general,technology_robotics	স্ব-উদ্ধৃতি
d4d04838b00230f51a155f19463e5c6e0a15eba74e5029e0e6bd0cfc3bddf748	জেঠ মাহত হঠাৎ জালিহঁতৰ গাৱত আৰু ওচৰ-চুবুৰীয়া গাওঁবোৰত হাইজা লাগিল।		Assamese Novels
d4e82277c3055480f3e42b35933ed20e92e864c8ce34d2d92014c7cb90934acd	হেঁতাখনেৰে দাইলখিনি লৰালে আৰু আঁচলত হাতখন মচি-মচি বাহিৰলৈ ওলাই আহিল।		স্ৱ-উদ্ধৃতি 
d4ebee1552f282362d5a3286ce88a0358dfe967181d5230c854aec57ca2ec800	শুকুৰবাৰলৈহে মই যাব পাৰিম যেন লাগিছে।		স্ৱ-উদ্ধৃতি
d4ef588e540937c6053bbd177eb4a0486da1c656a831e6a7e623bc70405f7296	বিপদৰ বন্ধুহে প্ৰকৃত‌‌‌ বন্ধু।	language_fundamentals	জটুৱা ঠাঁচ 
d4f369b4c57ecb42c732449e61dcf2909ee02e2c8ddbfa7af7d6aeb9b9995a6d	পোৰা আৰু কূটা কাপোৰ দেখি কৃত্ৰিম খঙত জলি পকি তেজীমলাক মাৰি তাও কৰিলে।		Assamese stories
d52f0c468dead06c8760afaad24f9c285d8de3f9f656176ce507da4cc9701124	আৰু এই ন-সূত লগুণৰ ভাৰ মই শুদাতে বৈছোঁ বুলি তহঁতে নিভাবিবিহঁক।		????? ??? ??????
d5309f641823b6936c3c7f43daddf392c286c95373ed2e86e9a3eea3586ecf5d	এই বছৰ ছেমছাঙে কি কি ফ’ন লঞ্চ কৰিছে?	technology_robotics,general	স্ব-উদ্ধৃতি
d53f0ea82c0a34a2e40b9e8c73f03ed74144569703cc56ab7a049452847384af	মধুৰ সুশীতল ৰাতিপুৱাৰ বতাহ কিয়বা তেওঁৰ গাত বিষ যেন লাগিছে?		???? ??????
d54632a3e3249ec049e6609fca3e97024a28fc01d5a8cfef01a066fb3a619303	সেইসময়ত আমি ব'ন মেৰ' ট্ৰান্সপ্লান্টৰ ওপৰত গবেষনা কৰিছিলোঁ।		Sentences from various sources.
d5552c3d0537398fb6235939610350ef64c7b8c128249f66af87607ffc21f33c	ইয়াৰ ফলত প্ৰথম ইঙ্গ-মাৰাঠা যুদ্ধ সূচিত হয়।		Sentences from various sources.
d559a0a2fbc9cd82140134e2c4bb275c3eb5a05a63f33559b7d858fe9a3b1383	আশাকৰো ইয়াতে এতিয়াৰ পৰা মিৰিৰ ঘৰে ঘৰে সুফল ফলিব।		Assamese Novels
d55aa96cf2ce47b062b742cd74fb918c4da7611c6c9bd79f33167d2fdcaa3e7c	ৱানপ্লাছত চাকৰি কেনেকৈ পাব পাৰি?	general,technology_robotics	স্ব-উদ্ধৃতি
d5787968bafac8c3dfc7bc436d94230f28197e8d201e4d7efb54e17296e0a1bc	সিহঁত দেখিবলৈ বাহিৰে যেনে হৃষ্ট, পুষ্ট আৰু বলিষ্ঠ, ভিতৰেও তেনে সৰল আৰু সৎ।		???? ??????
d59139e2e8e2587b00e7bcfce372b34ab8a820c1b696b5061d26ddab1ccb15c3	মুঠেই ছোৱালীজনী লগতে আমাৰো যাতে মান হেৰুৱাব নালাগে তাৰ কথা ভাবিহে কৈছো।		Assamese Novels
d59938ede83e388be65facdc5ba010051570a1b42ee53d9db8c6f1e7767d4a81	আছুছৰ দোকান ক’ত আছে?	general,technology_robotics	স্ব-উদ্ধৃতি
d5af8bd80178285092096f10fcb5fa1e8e77f8dad6276b31f846dadbc335fb5c	চালাদ বা চাটনিসমূহতো জলকীয়া ব্যৱহাৰ হয়।		Assamese Wikipedia Articles
d5b53c4778e0f5ba614646582ae31ad14b11ebbad01e0b3b61105c04d58c807f	"""বাটত আহোঁতে বুঢ়াই কেনেবাকৈ নামটো পাহৰে বুলি ""নোমল"" ""নোমল""কৈ ৰিঙিয়াই আহিছিল।"""		Assamese Novels.
d5c32f15ee11afe3e2b4b2d723d612eecdffbc6becd9fa09542ec73ac69fa482	দুখ-শোকত হেজাৰ জুৰুলা হওক প্ৰকৃত বীৰত্বৰ সেই তেজটোপা কেতিয়াও তেওঁবিলাকৰ হিয়াৰ পৰা নেযায়।		???? ??????
d5cb55d2822de57b4ccf46b5eebd311502d069891c00162ec20f3c19e08f959b	মই ফকীৰে কোৱা শুনিছোঁ বোলে ফকীৰৰ জীৱটো ব্ৰক্ষ্মাৰ ওচৰত থকা শালিকা চৰাইজনীৰ গাত আছে।		Assamese stories
d5d224ca5ff6a7dbb3b15cbbae2542fbd5f1bbd1b08d88575bddb4027e7953c6	তোমাৰ লগত আছেনে?		Common Assamese sentences
d5d60ffef3723b425777a891bc2c16a9385347a6ddedaffd90d27490609c67c7	মিতিৰ-কুটুম, লা-লগুৱাবোৰৰতো কথাই নাই।		Assamese Novels
d5dc91ea633fd7f721c5a5470417c9111e9187feccccae1cfc40c30a32165c56	"শিৱসাগৰত ""সুস্বাদু"" নামৰ এখন ৰেস্তোৰাঁ আছে।"		স্ৱ-উদ্ধৃতি
d5eba284bfa96b7e33fad0bda11f6f414dc7499f3e11fb1002f618901cb71fc5	দাদা, মই আৰু আমাৰ নতুন বৌজনীয়ে একেলগে ভাত খাব বহিলোঁ।		Assamese stories
d5f1c79edf7ff6d105625f8e022ba0cab6df6b60050781a8f9c1bc6e6467493c	ষোড়শ আৰু সপ্তদশ শতাব্দীত এই চহৰৰ অন্যান্য যি নামসমূহ নথিভুক্ত হৈছিল।		Sentences from various sources.
d6067c48d69c0aebd28487ba732feeff7e314e8303362191dbf8538d085e8135	ক'ৰ মাছৰ পেটত সেই চুলি ওলাল, এতিয়া তেওঁ তাক ক'ত বিচাৰি পায়?		Assamese stories
d60f2f1c32d3770868f015ebe39fb1df6bd7853ee06baa3fd02551d7069a7b17	দেউতাৰ শত্ৰুলৈ মোৰ বিশেষ স্নেহ বা আদৰ থকা বাবে যে মই এনে প্ৰস্তাৱ কৰিছোঁ।		???? ??????
d64ba476311dde76e3490c9ab77dc6a69f6ff976c9041e2529b5a1b7f4428652	তাৰ আগত ভূত নাই, ভৱিষ্যত নাই, স্বৰ্গ নাই, নৰক নাই।		???? ??????
d66c0ecb8f0458c4fe36e3172f5fadf3dc28ac08b531bd7635082a52f96b6eea	এনে হোৱা দেখি এলাগীৰ ওপৰত লাগীৰ নথৈ খং উঠিল।		Assamese Novels
d67010483a72c96b5beb668d4afd6b52ec0802c959bcb65bed3102b7236302a4	"""বুঢ়ীৰ কথা শুনি সাউদনীয়ে আচৰীত মানি ক'লে- ""মই হ'লে দেখা নাই।"""		Assamese stories
d67324b31d8160a1ca91206e911c693e5bf8d14ce5ec494bffcf0c313fee03f8	বাঘ দুখোজমান যোৱাৰ পিছতে কেঁকোৰাই আকৌ ৰিঙিয়াই মাত লগালে।		Assamese stories
d680f8ad9b0d5c8a875277aea263d68fa11842b4b4fb77cd00d6fde25f789d93	শোৱা চালপীৰাৰ খুৰাও সেইদৰে ভাঙি লগাই থ'বা।		Assamese Novels
d68195f0e101a2d316d0b1967338d21a6d9ef4d874b5662e784e336ad5761291	মাকেই ল'ৰাটোক বেছি আসৈ দি দি মূৰৰ ওপৰত তুলিলে।		স্ৱ-উদ্ধৃতি
d68ae8e8415a452835a046ecd51c6998c7e0a7010d8a46cd5da8807ac5a239c9	সেইদিনা দৈবাত্‌ গৰুটো ঘৰলৈ উভতি অহাত সন্ধ্যা লাগিছিল।		Assamese stories
d68f6aef2f50682fe4deea73a61ac92bf32c0ff346cf2dae2d65ec032a18c673	হালিৰো সৰু ল'ৰাটো আৰু ডাঙৰ ছোৱালীজনী ঢুকাল।		Assamese Novels
d6975316d826a7da48bcd3b68b790ce9e51051a2bc64d1f64121a309aaea652c	মানুহ মৰাও ইহঁতৰ আমোদ! এনেকৈ নো বাৰু মানুহৰ হৰিষত বিষাদ মিলাব লাগেনে!		Assamese Novels
d69d6f899680f22f9bfae1d778dfd5dc7cb63e396a0cb2180970a8032c6b9c70	অসমৰ ভোট জলকীয়া পৃথিৱীৰ সকলোতকৈ জলা প্ৰাকৃতিক জলকীয়া।		Assamese Wikipedia Articles
d6ab4fc720560e3bc939efe0f3d8a7f55962e446b7d06275b563834fa3873ad0	আগতেই উল্লেখ কৰিছোঁ, মায়'পিক ৰোগীয়ে ওচৰৰ কামকাজবোৰ সাধাৰণতে ঠিকমতেই কৰিব পাৰে।		http://www.xahitya.org/2019/09/22/%e0%a6%b6%e0%a6%bf%e0%a6%b6%e0%a7%81%e0%a7%b0-%e0%a6%ae%e0%a6%be%e0%a6%af%e0%a6%bc%e0%a6%aa%e0%a6%bf%e0%a6%af%e0%a6%bc%e0%a6%be-%e0%a6%a1%e0%a6%be%e0%a6%83-%e0%a6%95%e0%a7%81%e0%a6%ae/
d6ae3746bfd1a5d8c46383e901b5a0903eb5b8c08faec8404252028df5e3f67f	অৱশেষত তেওঁ দেউতাক আৰু সূৰ্য্য কুমাৰৰ লগত যোৱাটোকে স্থিৰ কৰিলে।		???? ??????
d6b6dcf225fdab55d110aa83bdb8dd0166c1a3704637b76e49fe49992e0b5d3f	এই দ্বীপসমূহ যি সকল দেশীয় ৰাজ্য আৰু সাম্ৰাজ্যৰ অধিকাৰভুক্ত হৈছিল।		Sentences from various sources.
d6b987fa27430ef6d5415cd644939357542f561f30101e14827ee1b9aa0f2333	সখীয়েকৰ ঘৰৰপৰা তেজীমলাক বিয়ালৈ মাতি পঠিয়ালে।		Assamese stories
d6cc4af657d74f74ed457e226d4f1f5b62fb83de77b4f655e3b7a3fe36d11c39	সেইদেখি তাকেই তেলাল ছাগলী বুলি ভাবি ভাল পাই বান্ধি সিহঁতে লৈ গ'ল।		Assamese stories
d6cfb1a9acc533d9279d6172673d91fdb80a76dc977dbb66361da890aef66f89	এই চেনিৰামকেই কিবা এটা কৰিব লাগিব।		Assamese Novels
d6e405b386029accc6dc68008e1fdfebce469b2ca94b11e5c140e749d3e5e5f0	মাজে মাজে পানীৰপৰা দাঙি জালত উঠা মাছবোৰ ধৰা হয়।		Assamese Wikipedia Articles
d6fe3251c608b7c43b3392a112ed891d5562f6949f3d3584a39fc07835e8dc97	মই আগুৱাই গ'লোঁ।		Assamese stories.
d7016fb2ff8b4822eb603d67dcf12dea423a4f2e393f060f5e209349f3ceda11	কৃষ্ণই হাতে ঢুকি নাপায়।		Sentences from various sources.
d70617a0ec3faf9f1ef9fd8fb23ac1c63df71daee611229521b6a6ea51d748b0	শিয়ালেও নিজৰ মান ৰাখিবৰ নিমিত্তে মৰো-জীওঁ-সোঁ-আধিকৈ পানীত পৰিল।		Assamese stories
d7068bb963d1dcbd13b9e3c288f46cfc0bf223c391b44f7dce3bd23c850a02be	নিদিলে মোকৰ্দমা কৰিম বুলিছে, কৰিব নোৱাৰিছে!		Assamese Novels
d70d5cf9eb3ddfc5244e047c915c0b2e119726e0dc587be27be5ed03261d937e	ধৰ-ধৰ মাৰ-মাৰ লাগে।		Assamese stories.
d7150947a41e3081226e0c48d396f9a0a1fc8bbc56b0810ecd5c468841375339	শোষকে শোষণ কৰি শেষত শাস্তিৰে জীৱন অতিবাহিত কৰিব নোৱাৰে।		স্ৱ-উদ্ধৃতি 
d73151bf89119b8d43988b0978ff2f53abd65c00604b61c5c6b5089b455a5ebe	 সমবায়-সমিতিৰ সমস্ত সদস্য সকলক যথা সময়ত উপস্থিত থাকিবলৈ অনুৰোধ জনালোঁ।		স্ৱ-উদ্ধৃতি 
d743686d7f1fb4852372e8e1b1be9c95e4ff4c3af3977252da12467db5030de3	লেখনীটোত বিস্তাৰিতভাৱে পঢ়িবলৈ পাব।		স্ৱ-উদ্ধৃতি 
d7443aed9ad49b69a54bf93dd010c6c38dfd66d8280530f106c3fa312dba010e	মন্ত্ৰীৰ ঘৈণীয়েকে ইমান মাটি-সম্পত্তি কিনিবলৈ টকা ক'ৰ পৰা পাই আছে ?		স্ৱ-উদ্ধৃতি
d744d616e1d5b1405bc4ce57684206cc4074c5b2f3b771ff5082cd874e38804c	এই প্ৰশ্নৰ উত্তৰ আমি এতিয়া দিবলৈ কাৰবাৰ কৰোঁ ৷।		???? ??????
d74d7507cccd3847b63f1f35f58c783395d192f80610f8663b89b69a1aeb1474	ভজা মাছ আৰু চৰ্চৰীয়া আনি জোঁৱায়েকৰ পাতত দিওঁতে জোঁৱায়েকে ভাবিলে।		Assamese stories
d74ebca10873beb7035f4144db623e9933fe8d1fdeb717b2cb92131ce389b4a8	পাৰি থোৱা কঠীয়াবোৰ গেলি যায়।		Assamese stories.
d76508a854f4f301f6098fb879215c1fc5c914cb490d9a7be789736b67ef06bf	মোৰ ঘৰলৈ আহিলহেঁতেন, মই কেতিয়াও ওলাই নগ'লোঁহেঁতেন।		Assamese Novels
d76a2335a4f7de49c9913a5fab8aa39ea23b881738c51166cac1b8f45a6de5c7	কয়লা ধুলেও ময়লা নাযায়।		নিজা
d76e80d31ae976b97460769e571d81f6636b9d578b16cc0de4bf5a21e3190e01	"""তাৱৈয়েকে ক'লে, ""যোৱা এতিয়া বেচি দিয়াগৈ।"""		Assamese stories
d7720b28406b2312e6456322a6678d2aaff2b61747e2c6f1cca529ec6ce37aa2	মোৰ মতে তাৰে যিটোক মনে-পিঠিয়ে আঁটে, তাৰ লগতেই বিয়া দিয়া হওক।		Assamese Novels
d7756cb69114c76557f22e1f4ef611beca559f867c199a6437b02e1e5b9c5602	এনেকৈয়ে ই ডাঙৰ হ'ল, মাক-বাপেকো বুঢ়া হ'ল।		Assamese Novels
d78adcdc79a542178fc359e5ac99cb4bb5caace2f71f0199d936f05401435cbd	সেই কুৱেকাৰ পৰিয়ালৰ ঘৰত তাৰ পাছদিনা বৰ আনন্দ।		Assamese Novels
d78dae06ed09a9e3052c5e6da58dd9e10f28b10f6f0020db924e9c60b041a6b2	ইয়াৰ অন্তত হাতেৰে চেপেটা কৰি তিল আৰু গুড় দি তেলত ভজা হয়।		Assamese Wikipedia Articles
d7965663054f4e9630f6ab6744f8e397a99f32507086e081519f05c7087f0f16	বামুণৰ কপিলী গাইজনী বৰ দুষ্ট আৰু চুৰুণী।		Assamese Novels
d7cd6759782179faea2e749ce646a787e07f4791e204052c4686aaf3fa688b6c	ইমান বৰষুণ দি আছে কেনেকৈ যাওঁ?		Sentences from various sources
d7cdcd798aa6d3b862398e970dafd69e1d1c21687888381e77afda34907ac97b	দুদিনৰ মিটিঙৰ জেজু আইলেণ্ড চাবলৈ সুবিধা কৰি দিলে।		Sentences from various sources.
d7e891f78e2b4a24f82cc461093647d9cf5007f6c2902c8b7c44d95903e62ebc	"""স"" আখৰটোৰ অসমীয়া উচ্চাৰণ ""চ"" বা ""ছ"" আখৰৰ দৰে নকৰিব।"		স্ৱ-উদ্ধৃতি
d7e8e8fb66d318f3da6927e5e77ca7167d06c55ae97324c37b879daa7f3b5eba	হুৱাৱে’ত চাকৰি কেনেকৈ পাব পাৰি?	general,technology_robotics	স্ব-উদ্ধৃতি
d7f2278c75f11811484e023da46dbdc44cc3cc0bbfd0f9e2829546eda699e406	শুক্ৰাচাৰ্য্য‌ই দৈত্য সকলৰ কপটতা বুজিব পাৰিলে।		Sentences from the Xahitya.org articles.
d800967495a6d94ee8f0d7d6e20ecad8f2db878c96b747f31b47fd3776c8fbc5	সিহঁত তাতে থাকে মৌজাদাৰৰ খেতি-পথাৰ আৰু আন কাম-বন কৰে।		Assamese Novels
d803d51d99c75f75cff8f1d719d38c4003bd1d85a8cdc42f292700bcef3c054d	তাই গাভিনী হৈছিল।		Assamese stories
d80df020cfc3d7bd4617c53901692147dd55df81655bcc2d039cb10d6c49d8bf	আগ বাঢ়ি আছে ইপিনে আমাৰ বন্ধু সকলেও প্ৰস্তুত হৈ আছে।		Assamese Novels
d812555057e5e7aaccb8f3deb53bb4765c646ad84e58ce6f8301b83a4d55d502	তাক দেখা পায়েই ভালকৈ ধৰিছিলোঁ, বোলো আজি মোৰ ধনবোৰ তাৰপৰা নুলিয়াই নেৰোঁ।		Assamese stories
d81a2c1c696699dfa8b2c314311ee9db329952f2eff8e3838bc66b2f73cb7343	এনেকৈ গাঁঠি যাওঁতে ওপৰফালে সৰু আৰু তলফালে ক্ৰমান্বয়ে বহল কৰি অনা হয়।		Assamese Wikipedia Articles
d8241d62f12e76a2f3a755f37c948ac180d6ebc6d33d99c71589a2a6384fbaf0	ক'ৰবাৰ পৰা এডাল চুলি উৰি আহি সদাগৰৰ কোলাতে পৰিল।		Assamese stories
d82df70d9c232b26a379f78ad9312ae94fe895b2d00fe7cfa84db1c72055d5e8	বিজ্ঞাপনৰ টকাৰে নিউজ চেনেল চলে।		Sentences from the Facebook group 'Oxomiyat Kotha Botora'
d8387e705b3db1c33a1bb5d0a5b533d12be278ef6c1375cbae015733f28fb7d5	"""মই নামটো পাহৰিলোঁ।"""		Assamese Novels.
d84523bd6fee57c80fe84536603c0bd869d7f12f26bcd1ab4ba92558b0aa6ac8	বয়সৰ হিচাবত এজন চিনিয়ৰ চিটিজেন।		Assamese stories.
d84b96b8f9d5adb9b98a00235a5edf031d079f7021a527c575598da586f733e4	এনেকুৱা এটা লিখনিৰ বিপৰিতে হাজাৰটা বিৰোধী লিখনি ওলাব লাগে বুলিয়ে কথাখিনি লিখিলোঁ		Sentences from Short Assamese stories
d87b925c26f5595db54486f3ea722b12cbb89a9cd7516863ab75683ce5082304	মোৰ লগতে আমন্ত্ৰিত আছিল ইৰানৰ আৰ্দেছিৰ ঘাৱামজাদেহ আৰু চীনৰ হি হুৱাঙ।		Sentences from various sources.
d882d9a49ad3290ea7c8e56639e891d29c0aaa8e68c6aa0733f0bf4db80daeeb	তেজাই তাৰ ওপৰত বহিলেই যেন খুৰা ভাঙি যায়।		Assamese Novels
d89fb415418d1f21ff1fbef9a0fdb8e220ab1ddfef91971a9ef05bfac9f26512	"""কলে- ""আপোনাৰ বাবে নকলে যে?"""		Sentences from various sources.
d8ae9f8eeb25f616fb1cf321a3f0ca9b70d364f8a904eed1f07ee35df0e37679	আকাশত চাং পতা।		অসমীয়া ব্যাকৰণ 
d8b621607820aac74d83981e0a46243282788efc1155679b680beee0e5807734	যাত্ৰীয়ে কেডাৰনাথ যাত্ৰালৈ লগত লৈ অহা গাড়ী চিতাপুৰৰ পৰা আগলৈ যাবলৈ নিদিয়ে।		Sentences from the Facebook group 'Oxomiyat Kotha Botora'
d8b6e926a774bad84aa66adede318b30f65209c1f65478a08d7578633ada820a	দিবলৈ পাই বৰ ভাল নালাগিল		Sentences from Short Assamese stories
d8beffd52d55dc3577d611458bea0e81dece4be95cfe1c7bf560109bc6263d51	বাৰীৰ চুকৰে মাটিডৰা নুমলীয়াকৈ ৰুবলৈ কঠীয়া পাৰাগৈ যোৱা।		Assamese Novels.
d8c2e6f0681e5645f068ff7204089b6b7e0a5aef88d4de0552b19a1ff13e0ea5	"""ৰাণীয়ে উত্তৰ দিলে- ""ভিতৰত আছে আহিব এতিয়া।"""		Assamese Novels.
d8c4b46ed445aa1c34e9d51017f78a0011c5ab8d98b15b0d75265aea26c5133a	ষ্টুডেণ্টৰ বাবে মাইক্ৰ’ছফ্ট ছাৰ্ফে’চ লেপটপ	general,technology_robotics	স্ব-উদ্ধৃতি
d8c7f1978877f8c438c9214a9900db739e8f2063591540cbcfca75400c1b556e	পাবলগীয়া সাধাৰণ পইছা কেইটা পাবৰ দিনাই তাৰ মৃত্যুৰ সংবাদটো পাই মনটো বেজাৰেৰে ভৰি পৰিছিল।		Assamese stories.
d8ca869ba0719c0fe57f119cb492ab51e5b8558b957268718fbb2008a58a4b4f	এজন মাছমৰীয়াৰ কাহিনী।		Sentences from the Facebook group 'Oxomiyat Kotha Botora'
d8d846977da6da3245bb57eb31ba4e787e7f4043f01f3a4046fddfc1d2ee9d15	ৰূপকোঁৱৰ জ্যোতিপ্ৰসাদ আগৰৱালা।		স্ৱ-উদ্ধৃতি 
d8f14432c26e67f02ddc1a46c6bae5039e57c4567b5bd071df8df07e8e627167	বাপুৱে স্বুলত যায়।		Sentences from various sources.
d8f82b012e17ba6efb87f3aefd14301b575fc7aeb27547a4fd11f4ef940ebd49	শেহত কেইডৰামান খাজনা ভৰাকৈ দিলে।		Assamese Novels
d90e382f436866125fed9dcc969f411b05539a9df09d0b2f4cce07fc4d6ebecc	ৰাখে হৰি, মাৰে কোনে?		অসমীয়া ব্যাকৰণ 
d91636f67d7051c256d61a7fd866cbca1501d784af9c169e26f39bafbc9110b3	অলপ পৰ পাছত মিছেচ বাৰ্ডে মাতিবলৈ ধৰিলে।		Assamese Novels
d92d1eabc5091dcbacbf7bca5d6a5b54e0780f52321809cb301e8dfbe8395ca1	তুমি গাখীৰ খাবলৈ সুকীয়াকৈ আমি তোমাক এজনী ম'হ দিম।		Assamese stories
d93537aab76eb83a8a4be749555cf0e1b9ab5c36f20426d970ca03c356335f01	উৎফুল্ল হৈ প্ৰকাশ কৰা মহিলাগৰাকীৰ কৃতজ্ঞতাবোধে মোৰ লগৰজনৰ মন ভৰাই তুলিছিল।		http://www.xahitya.org/2019/09/22/%e0%a6%b6%e0%a6%bf%e0%a6%b6%e0%a7%81%e0%a7%b0-%e0%a6%ae%e0%a6%be%e0%a6%af%e0%a6%bc%e0%a6%aa%e0%a6%bf%e0%a6%af%e0%a6%bc%e0%a6%be-%e0%a6%a1%e0%a6%be%e0%a6%83-%e0%a6%95%e0%a7%81%e0%a6%ae/
d937e9056d2c46c538f2b939471ef186c2e01ff628ee2b7f822e10d49d0ec3cd	মনে মনে কান্দি-কান্দি মাক বৰকাছক সেই বাতৰি দিলে।		Assamese Novels
d976abcf8633f4dafe3eb1c90d690e7ec2742a5f4dcbfdf68bbdd5c9502cc16a	সখী মোৰ ওচৰতে আছে।		???? ??????
d985476e65e8ed114b3a97a531bb3432d19880b5925a103deb4b8d5856420087	তাৰ উপৰিও ল'ৰা-ছোৱালী এমখা লৈ আইৰ ঘৰতনো কিমান দিন থাকিমগৈ।		Assamese Novels
d9922edb1e8f25a2a931023de781619bf2541e4e064c09bdb3bd16c40107eaec	তাক সৰুৱাবৰ উপায় নানে?		Assamese Novels
d9b2c6f7d42126080efe3a684aa0cbd50547085c287d2777e71483c2e21bc840	সকলোৱে লাগিভাগি খাই শেষ কৰোহঁক।		Assamese stories
d9c562dea69c27929812916c1fccbfbfa130c14a9f686de5c900687455d8c808	যি অলপ সম্পত্তি আছে সেই সম্পত্তিত আমাৰ সকলোৰে সমান অধিকাৰ।”		https://as.m.wikisource.org/wiki/?????-????/????_???_???_????_????_??????_??????_????
d9e59534e83b215ab800ad1433804b96a4f1547781b57d3b539f610a3c2335e4	তুমিয়ে মোক কৈছিলা ন?		Sentences from various sources
da0115abe4462157bf91f464f4b52ac4cc8595e52fb7e53acdb5d71d6c04d99b	বৰং কৃতজ্ঞতাৰ ভাব হে জন্মিছিল।		Assamese Novels
da2177152e9e03d535523e3258ea5a8c092aadb6d344d4d8eecf455d650dbf0d	তাইৰ কথাখিনি মনত থাকি গ'ল		Sentences from Short Assamese stories
da34715dadc77dc02485de3c8959129deaeaf81f43bb33b46a2456f7dc9e6383	আন এটাইকেইজনী বোৱাৰী মাকহঁতৰ ঘৰলৈ গ'ল।		Assamese Novels.
da3faa29c30b7aa6d0c1ad68cc654e121e39f0c775fe3b670c7a6a0117f74241	পানী এদিন দুদিন নেথাকে।		Assamese stories.
da4406626c6619fd6cef93aa937a10a648664666f5a1666f82695dec626bc9f6	সেই দেখি মৰিলতেই হেঁপাহ পলুৱাই চুমা খাই আৰু সেৱা কৰি লওঁ।		???? ??????
da462b4aebd61e847015272ed2048f2730fe6ec3dadfb417798ea1446b02026f	একমাত্ৰ বৰজনাৰ ল'ৰাটি ঘৰত ৰ'লগৈ।		Assamese stories
da53b0806cb51a4e7e4f0872078954ebfd9ad3d1a0d9019d8a701019516241fa	এই ৰোগত জালিৰ প্ৰায় সকলো গ'ল।		Assamese Novels
da58b0dff7d6c2e7cc4bec7dac820269a5587483b6e7e4788dfe201342433ba7	আজি ৰাতিলৈ বৰষুণ পৰিব।		স্ৱ-উদ্ধিতি
da683508cff0cafe0bb7f9d6fb9862708c749fd91759da5205607b3c9c0d11ca	এপলক কেনেকৈ যোগাযোগ কৰিব পাৰি?	general,technology_robotics	স্ব-উদ্ধৃতি
