sentence_id	sentence	sentence_domain	source
ae7307278a735fa43b3dd245b0a08cd27356f4a5d6d77d74dbbe60a247c068ad	চৈধ্য ব্ৰহ্মাণ্ড গোটেইখন কথা ক'ব কিন্তু ঘূৰি আকৌ নিজৰ মূল উদ্দেশ্যতেহে পৰিব		Assamese books
ae782acb6a9fad04bb01b53caaa8887459fb59425af127a34f541730bc50c1c5	আৰু আটাইকেইডাল নঙলা বন্ধ কৰি থোৱাৰ কাৰনতো হ'ল		Sentences from short Assamese stories
ae7dc26630adc23b0237ec75ada217b995beb5a30da38eece0acb7a628f7a68c	কি কৰিম কি নকৰিমকৈ দি দিলোঁ।		Sentences from various sources.
ae91164be6797a4a0764a1318375e56b765507581441a78b4389681868f038d5	গুৰু নানক জয়ন্তীত মই সকলো শিখ ধৰ্মাৱলম্বী লোকসকললৈ মোৰ আন্তৰিক শুভেচ্ছা জ্ঞাপন কৰিলোঁ	general	স্ৱ-উদ্ধৃতি 
ae96424be46ec60d16191c3ccb3dbae4d4001e981b933a81936c1900e1721b85	এই বিদ্যালয়ৰ পৰা প্ৰতিবছৰে চমে-চমে সুখ্যাতিৰে উত্তীৰ্ণ হৈ আহিছে।		স্ৱ-উদ্ধৃতি
ae9a2a37501576fd9c8099817573dea73a501a8f33f655d714fbf14f314b39af	এই সময়চোৱাত কাজিৰঙা ৰাষ্ট্ৰীয় উদ্যান বন্ধ থাকে।	general	বাতৰি কাকতখনৰ 
aea88b051b2fa2e93c25dacf8175ff45b64d99ab29ea9761d3fdebf5d4c91051	ভিডিঅ’ এডিটিঙৰ বাবে লেপটপ	technology_robotics,general	স্ব-উদ্ধৃতি
aea9bc3f3b64350cb32163b10a7790e95ba4d73ac550e63353b898b6e466ee7b	আমাৰ এপক ফাইভ ষ্টাৰ ৰেটিং দিয়ক।		Common Assamese sentences
aeb009277660885999979c1c0e63f7a58f3f5be7ece248a43ba3696776195109	ডেলক কেনেকৈ যোগাযোগ কৰিম?	technology_robotics,general	স্ব-উদ্ধৃতি
aeb037f6d4123fb05d2cc57f5c04652c5d41f4c3cf193692ac3eebfe2b35fecf	তেওঁ তোমাক এৰি এতিয়াও জীয়াই আছেনে?		???? ??????
aeb5279d950b66ce9970eafd0914eb7a8a063991e488274f43312b017e35913a	তাই এই কথাত ডালিমীৰ বাপেকেও মত দিলে।		Assamese Novels
aec86a6fa73f6a720c9df425bd452630db64d2f30cf9a349806fad5b861590d7	মেকুৰীটোৱে নিগনিটো ধৰিব।		স্ৱ-উদ্ধিতি
aecebda79f44006d98136f61bccd3148e4aa8545fbd1be77121b39b6a75224de	  ক্ষয়-ক্ষতি 	general	নিজৰ 
aed4cbfee00e71f4b3af5b09530c1cd4002438de212f073d683570d80c6da22d	পোহৰৰ অনুপস্থিতিয়েই এন্ধাৰ।		Sentences from the Facebook group 'Oxomiyat Kotha Botora'
aeda0f25aff20fc893e7e9c15570ff7353e0544b562177781e5abcc2f35aa7a9	শিৱৰ আন এটা নাম শম্ভূ।	general	সাধাৰণ জ্ঞান 
aee603d6c150e63f53c4c1082def3314efeaf061b7e8545e7be6d79f841b0dde	বিশেষকৈ তিৰোতা আৰু গাভৰুসকলে ইয়াৰ ব্যৱহাৰ বেচিকৈ কৰে।		Assamese Wikipedia Articles
aee9b1483221d4242891d7e4bd7394ab33e62b00c3ee929bc161041ab2a00018	বুলি লিফ্ট এটা খুজিব পাৰে		Sentences from Short Assamese stories
af09c88639a9442fcf7c3a91143fa1c030a34a6823a5790adbb47147a443cd48	দেৱতা নে মানুহ? নে অপেশ্বৰী? নে যখিনী, কোন কোৱা?		Assamese stories
af2fd1bd030392b581cde5af74f906b3e375ea601a7b349f97dfdf8a4435760b	সি দেখিলে, গছজোপাৰ তলতে বনৰীয়া ম'হৰ খুঁটি।		Assamese stories
af3e9e313775cbbc3a8e72c17b917474a138d296a32b4c932fae7e178be600a7	যে তেওঁবিলাক ঘৰ সােমালেও পানী চুৱা যায়।		Sentences from various sources
af4c68e1036aeb71ef815dadcb6af928cb0309b495f6565ab5e873df24e37ba5	ফেনে ফোটোকাৰে ওফন্দি আহে দিচাংৰ বুকু।		Assamese stories.
af4f15f1440a200602afff644835160cb0962b19238b35d7acabd557576b36ba	কাজিনেমু বছৰটোৰ প্ৰায় সকলো সময়তে কম-বেছি পৰিমানে উৎপন্ন হয়।		Assamese Wikipedia Articles
af5389d5139be3ebf8535effc89d08095893fe46a1c8fb11cb6b90480dd013dd	আজি ভালেমান দিনৰ মূৰত আহিছোঁ, তোমালোকে দেখিছোঁ মোক সমূলি মৰম নকৰা।		Assamese stories
af6c310c21540b474fbdcba93492bc2f6427359f0dd4f0016440469a96c4422e	প্ৰথম, য'ত তেওঁ মন-প্ৰাণ সপিছিল, তেওঁৰ পৰা বিচ্ছেদ।		???? ??????
af7ac2b67fee872c193af94df68a0e45fdc6dea75b52edb3b4ba02c07b29b096	সিয়েই এই কামটো কৰিব।		স্ৱ-উদ্ধৃতি 
af8af47dd9833a1300508ea2e67449ef8182b81962f480f1bdc144dcd9cc4d03	ম’ট’ৰ’লাৰ শ্ব’ৰুম	general,technology_robotics	স্ব-উদ্ধৃতি
af9648e7c3412dd0f370ff74da38f32cf4eb9606657c96c430697b127b50fdae	বেঙেনাৰ খাৰ ৰান্ধিলে।		Assamese stories
af9fa65375a1cb69dd3ccc61662c9a77a2a178a119c5cdd9937032c409f10395	পায়েই সোধপোছ নাই ৰণুৱা এটাই দা খনেৰে হৰদত্তৰ ডিংগিলৈ কোব মাৰি পঠিয়ালে।		???? ??????
afa0750eec86d9225190980b77506dccd85731c954af61744cf09c6dc37ba562	"""মধু শৰ্মাই দেউতাক কলে- ""আপুনি বৰ ভাগ্যবান।"""		Sentences from various sources.
afa21a8577971e7f46acac4053e11e0f71f100c6f028184f340c3c82a5611dc2	চোৰ গ'লে বুদ্ধি, বৰষুণ গ'লে জাপি।	general,language_fundamentals	অসমীয়া জটুৱা ঠাঁচ 
afa9b19f8df3d7a426c0f36776327a63ab6702d7a45705645a7e633a90c1da3c	এইবিলাক কথা ভাবি ফুল ভালেখিনি বেলি কি কৰিব কি নকৰিব বিমোৰ হৈ আছিল।		???? ??????
afa9ff31d6c483c92e14dc25a960c496c7fe51f663c1c70d40d30458f8cd427a	ৰাইজ অহাৰ আগতেই এই কথা ভূ পাই ল'ৰা-ছোৱালীহালে বাতৰি দিলে।		Assamese Novels
afadf8a31fa3e67c9bdc471d36c8cbcb7154de6922f863e94a72c7b38bf5982f	কেতিয়াবা ফেকুৰি ফেকুৰি কান্দি আকৌ তৎক্ষণাৎ নিতাল মাৰিছে।		???? ??????
afc0262212b1bdb11e72fa415e28046096d8401714fc3b9c3639b64ea357e093	তথাপিও ইমান সংযম পুৰুষ সকলৰ?		Sentences from Short Assamese stories
afcf6d0c3cbd0fee152576904b90160fb1a110855b34d342c6a08cb97922daa5	এই আশাটি পূৰ হ'লেই তেওঁবিলাকৰ এই পৃথিৱীত আৰু একো তৃষ্ণা নেথাকে।		???? ??????
afd9a5647fbfba123b88585f40dcc4048057525ab26bd2885a66bf83e0ff104c	সূৰ্য্য নহ'লে ফুলৰ থিতাতে মৰণ।		???? ??????
afe5f05260b805463ada56c19e6bcaa1cf3b3898ac524550448adf88de1fefb1	তোমাৰ লগত ফুৰিবলৈ ময়ো যাম।		স্ৱ-উদ্ধৃতি
afed73005df7d468ecfc031fe902f589d11f134223ac1042c87da0c57e68fa0c	আৰু গিৰীয়েকক অতি কমেও এডুখৰি নিজে বোৱা ন-কাপোৰ সিহঁতে নিদিলেই নহয়।		Assamese Novels
aff130ca923352abbaba6a0619ad7a199a4ab85d344950684a9df4298944ce89	অতিথি দেখিলে খঙেৰে চায়, ভাল বস্তু পালে আপুনি খায়; তাইক পালে যমে মুখ নাচায়।		অসমীয়া জটুৱা ঠাঁচ 
aff2483ef4467a8a0aab59fa34a06f7282a3cec97a619fa3817adcf3ab846f1d	কিন্তু মোক মাৰি যেতিয়া মোৰ মঙহ বাছি তহঁতক খাবলৈ দিব, তহঁতে নাখাবি।		Assamese Novels
b000785979cf5ea42d366ca0bc90aeaa3f0c8ed56950392bc7b63fd15973b4c6	আন মুকলি ঠাইত ওপৰলৈ মূৰ কৰি থোৰাটো সূৰ্যৰ ফালে দি থিয়কৈ পুতি ৰাখে।		Assamese Wikipedia Articles
b031a6d5e99e93eb51dc8f57e1fe573eb7d38f6625390810d004aded5f3e9007	সুৰ্য্যৰ মুখখনিৰ পৰা বিষাদৰ ৰেখা নাইকিয়া হোৱা কেতিয়া দেখিম?		???? ??????
b0326f31316cc05a0767d8d3ba5a65710afdab8407c3aac4c506235ea34ef26a	সি তাতেই ৰওঁক দে।		স্ৱ-উদ্ধৃতি
b032ad211d193708484dc5ccdd828d3ed0e112b2cb4067502921770134ea82fd	এপলত চাকৰি কেনেকৈ পাব পাৰি?	general,technology_robotics	স্ব-উদ্ধৃতি
b0354d4fd417b0eefcb3f3da47e692848217faf6d662636885184e80f9688139	যেতিয়া কাপোৰে ঢাকিব নোৱাৰা শৰীৰৰ অংগ দেখি কাৰো লোভ লাগি নাযায়।		Sentences from various sources.
b051a4c282209fdfd16378ec20d2ba5f60fe14dde12d23dff5ff0c674ae45139	ডাঙৰজনী লাগী আৰু সৰুজনী এলাগী।		Assamese Novels.
b05a4fe3e5c8d5ebf78d1dffcfc570f8dc2e6030b7110851678b603bd85ec32d	তাৰ একমাত্ৰ ঔষধ হৈছে চছমা।		http://www.xahitya.org/2019/09/22/%e0%a6%b6%e0%a6%bf%e0%a6%b6%e0%a7%81%e0%a7%b0-%e0%a6%ae%e0%a6%be%e0%a6%af%e0%a6%bc%e0%a6%aa%e0%a6%bf%e0%a6%af%e0%a6%bc%e0%a6%be-%e0%a6%a1%e0%a6%be%e0%a6%83-%e0%a6%95%e0%a7%81%e0%a6%ae/
b06004e48afe073c2ca2f5a0a34df3565e252b77a4933baf223201502fadccbd	প্ৰেমৰ স্থান অস্থান, সময় অসময়, উপযুক্ত অনুপযুক্ত জ্ঞান নাই।		???? ??????
b062aae0eadc94056d512ff6aed47cb9659c399775830c0c1570bf8e5856ff85	তেতিয়াহে দেশ এখনত মহিলা সুৰক্ষিত হ'ব		Sentences from Short Assamese stories
b063466f0c00512fa51aabb30d609b600cf47c17156b17b67d08b104d0c42b9e	তোমাৰ হেডফোনৰ কিবা প্ৰব্লেম হৈছে।		Common Assamese sentences
b07138c120e140d4ee58c6d8c61475aed4777d9f9b87df2428c4c02059ba5ca3	আমি এতিয়া সূৰ্য্যকুমাৰৰ কথা কওঁ।		???? ??????
b08d4e7d18b2e85a134350bfd07acbb2ae62227a7e58b16e158d204ccd94d3ea	উলিয়াই দুঘোটমান পি দেহাটো সামান্য জুৰ পেলাব খুজিছোঁ		Sentences from Short Assamese stories
b09637b3329e22a7114f5e8561e057fe396f517c7865c225f59b2bc5c2c09f71	সাধুকথাটো ঢেঁকীৰ কথা পোৱা যায়।		Assamese Wikipedia Articles
b0a272d608e3e64a7bc881ed0118917fdd7ae7da7c9637201ebe0f238790d5ea	লাজত নবয় ভাৰ;জোলোঙাই ভাঙে কামিহাড় ।		ফকৰা যোজনা
b0a80b872d34864ad6723475379ed13e1c664d396e6e416bb4a4fb159e440853	নৰাইৰ এতিয়া সকলোৰে ওপৰত খং।		Assamese Novels
b0aaca3b89125db12989d1b5cf1f3c055632287242c1ee73fecf7b13031ead59	মোৰ মনলৈ আহে যিহেতু প্ৰতীকধৰ্মী এই কাহিনীটোত মই কিবাকিবি বিচাৰি পাওঁ।		Sentences from the Facebook group 'Oxomiyat Kotha Botora'
b0b2ca513a54b0fde44cdb331d231610ae83f076bd596d924bf257ec65067d9a	যে যি স্থলত গোঁসাই মহন্ত আমাৰ নিজ গুৰু সকলেও আমাক ঘিণ কৰে।		Sentences from various sources
b0bc0337fc27490e793afb335de059f6ade8ecf8e201cebd157b054ce9074437	ডেলৰ লেপটপ	technology_robotics,general	স্ব-উদ্ধৃতি
b0d0878a891967080747e35304106508f8e4a5e5b7da99f5b4e37b2c0174ea94	এই তিনিওডাল নঙলা খুলি থোৱা মানে - গিৰিহঁত ঘৰতেই আছে, বিনাদ্বিধাই ভিতৰলৈ আহক		Sentences from short Assamese stories
b0daf7bc19e87c4a267e6a2cf4d1106a6a1892a50396d832ffd19d51b4338458	কল্পনাৰ কেডাৰনাথ যাত্ৰা এতিয়া চকু মেলাৰ পাছতেই আৰম্ভ হ'ব।		Sentences from the Facebook group 'Oxomiyat Kotha Botora'
b0e4f43dbfd311e97c88cd9af4c8a8e053768adfbecf7fe64fc952131f6a3663	গম পোৱা হ'লে তাক বিচাৰি তাৰ ঘৰ পালেহেঁতেন আৰু তহঁতৰ ঘৰতো বিচাৰিলেহেঁতেন।		Assamese Novels
b1008deb3dad4bb9ed8c603ce7177dd08debf00d9eb1ed7f096a38200771dbb1	হাতত লৈ থকা মাছৰ মূৰটো পতককৈ মোৰ হাতৰ পৰা মোৰ থালখনত সৰি পৰিল।		Assamese stories
b1161d453b91309cf38d6e0d3658f4c7932ef915a03a8c510a49ff8abc51f899	তুমি তোমাৰ আগৰ ল'ৰা-ছোৱালীকেইটা য'ত পুতি থৈছিলা।		Assamese stories
b11e45515a5d715e7a37feb65b5a4e3f55bb9845bbfc6c0414fabbbe4453ab08	তোমাৰ লগে লগে আহি মই দুৰ্ঘোৰ অৰইণ পাইছোঁহি।		???? ??????
b12d1e9a4839ab8b3eef0286ea18771781b6b67583ab74361072876dc2726e09	গৃহস্থই পাৰে মানে সহায় কৰে।		Assamese stories.
b1388b73843b2ce184cda210d67b704dbdac41efe1dc4d634cab59824eb89227	ইয়াকে ভাবি কুঁৱৰীয়ে ওলাই আহি সৰব্‌জানৰ হাতত ধৰি ক'লে।		Assamese Novels.
b164064df8ea75c0037821895ecbfe5e1984d825df8012960b66fd124e968d22	সেই ৰামো নাই, সেই অযোধ্যাও নাই।		অসমীয়া ব্যাকৰণ 
b177e558de83acbd7249500ede690ba393fb10dc07feed84e082d454542b233d	"""অৱশেষত ফুকনে এইটো ভাবি ঠিক কৰিলে যে ""সূৰ্য্য অবিশ্বাসী, আৰু শত্ৰুপক্ষীয় লোক।"""		???? ??????
b179814faeefb3c0ab69ff623e25ea5c9370b303db4fc9f6f017d4c7e4ec1aae	কম বাজেটৰ ব্যৱহাৰকাৰীৰ বাবে এ’চাৰ লেপটপ	technology_robotics,general	স্ব-উদ্ধৃতি
b179b5521104c5616d3fabe599b9d661ffbd132788fade264d1fffab22ad235e	হুৱাৱে’ক কেনেকৈ যোগাযোগ কৰিব পাৰি?	technology_robotics,general	স্ব-উদ্ধৃতি
b1843a3ef40150f970de5cf108e88e65e065cd13e04d788951525df5a150c8f7	ইমান ভয়ংকৰ দূৰ্ঘটনা,যে বহু সময়লৈকে একো তলা-নলা পোৱা নাছিলোঁ।		স্ৱ-উদ্ধৃতি
b19f6dbbc2d5c2ed63c65651e3ab34e967e5ef6d1f11143c3ecf8d68cff8a02d	তুমি কাইলৈ দুপৰীয়া তেওঁক তোমাৰে সৈতে একেখন কাঁহীতে ভাত খাবলৈ ক'বা।		Assamese Novels
b1b0abe5c47e823765ba34f633d4c3bc4c948f7cfaaae61195a5607160c3f10c	তেতিয়া তহঁতে ভগা জকাই এখন লৈ আহিবি, মই তাতে উঠিম।		Assamese Novels
b1f90dde428dd587da45b434d264847ad4af24e3a8e9aad36077a3b43952b269	আপুনি অহা বাটেৰেই যাওঁকগৈ।		স্ৱ-উদ্ধৃতি
b20623a97a00fa5227184b812156e40259bf9bbf78d4161d1039692c54f67d80	জলকীয়াৰ কেঁচা ৰূপত বহুল ব্যৱহাৰ আন ভাৰতীয় খাদ্য প্ৰণালীত বিৰল।		Assamese Wikipedia Articles
b20a07207cf371379712f738fd572bc65e19e64c9a29c8d1430cfb48e1724733	এই দুই জগতৰ সামঞ্জস্যই সুখ।		???? ??????
b20ca61cbc47c9fd3a3508af24c7fa7356a79664043afcfad7c3b2eb30f2e951	বাৰ্ডে এই দৃশ্য দেখি এটি হুমুনিয়াহ কাঢ়িলে আৰু একে থৰে চাই ৰ'ল।		Assamese Novels
b221c36007228ff4167e17cbbef9b4648d1040d3b8c987c46a6ba6e565c10e26	সি কুকুৰৰ পুতেকটোয়ে এতিয়া মৰিবলৈ ওলাইছে।		Assamese Novels
b237d5b516aab5f303be6408098040a7e2a5acd40cc9e33a8236bb6fe68f92cd	আৰু উভয় ৰাজ্যৰ মধ্যবৰ্তীৰ অসংখ্য সৰু সৰু দেশীয় ৰাজ্যক লৈ গঠিত হয় মহাৰাষ্ট্ৰ ৰাজ্য।		Sentences from various sources.
b2387699b619de475693d12216bc9b0e8c0b385783e6d09b6f0437516b8434a9	ঔ টেঙা দিয়া বা খাৰ দি ৰন্ধা মাটি মাহ আজিও অসমৰ অন্যতম জনপ্ৰিয় খাদ্য।		Assamese Wikipedia Articles
b23aa468b43dafd00c0db40fe79c5428545762f7568cedf3e91f45c538be4547	বাঘে সেইখিনিৰ পৰা গুচি যাবৰ সময়ত বাঁৰী-কোঁৱৰক কাণে কাণে কৈ গ'ল।		Assamese stories
b24500ae9ea96d1ffc9cc92e3e9d3e5b35a71d33981651f4bc6acfebaf47dec4	"ৰাষ্ট্ৰ পৰিচালনাৰ নিয়মাৱলী অৰ্থাৎ ৰাষ্ট্ৰ-ব্যৱস্থাৰ বিধি লিখি ৰখা গ্ৰন্থখনক ""সংবিধান"" বোলে।"		স্ৱ-উদ্ধৃতি
b26641262b4ea02548863f93a9f511baf5df4b07abcb45fcbe8d007a01d35cc7	কেনেকৈ যাব তালৈ?		Common Assamese sentences
b26d182e9bb13da3fb0d53e9777368c41f2229afb65dc6b374aa6cda80f10a0b	এইবুলি বুঢ়ীয়ে কুঁৱৰীক বুজাই ভাত খাবলৈ আনি দিলে।		Assamese Novels
b2801e3fc1528dd17afbb7faf06becb00657c2fcfcafa94e0626a8fd8fd6e116	সমৰ্থকৰ সংখ্যাও বহুত বেছি		Sentences from Short Assamese stories
b290b6782b53ae2d0a6c7339d851fe6a1779674a1bd8f613003a8b07dc8a9047	মানুহটোৱে ক’লে,”ভালকৈ শিক, নিশিকিবি?”		https://as.m.wikisource.org/wiki/???_???_?????
b2925c241665f72be3deb8524219e693f27d6f9c64bfc4fc4ae68a28222eda1b	মোৰ নেজডাল এৰুৱাই দিয়াহি ঐ।		Assamese stories
b2994632b8aca119aa819f47629a55cd2e530fa3feddd0f5d4717b8b3c6159b0	আমাৰ গাঁৱৰ মানুহ শিক্ষিত।		স্ৱ-উদ্ধৃতি
b2a3700fe09117a5444b1d366088afb23d2d1dc208b2a7f3416d20ef6a31604f	কাৰ্তিকে ছয় গৰাকী ধাইৰ পিয়াহ খাইছিল, সেয়ে তেওঁক ষড়ানন বুলি কোৱা হয়।		স্ৱ-উদ্ধৃতি 
b2a7baccc83ffdfb6baac1341e7f064acc870213a90d94af84d926e0f77e24b7	কিন্তু সেইবিলাক ভাল পোৱাতো তেওঁৰ এনে অপূৰ্ব্ব মানসিক আবেগ কেতিয়াও হোৱা নাই।		???? ??????
b2aea4c27c4f7bc2cd6fcc68830d26abaf7ed75ee9ceb809411ee2131d022c60	গুগলৰ শ্ব’ৰুম ক’ত আছে?	general,technology_robotics	স্ব-উদ্ধৃতি
b2c19bfdf8f0dd822effda8a96b5a935447a0aa7feddcbf11cf947221bf4cc60	ই ইমানবোৰ হাড় দ'মাই থ'বলৈ ক'ত পালে?		Assamese stories
b2d571c56cc40abf59655df8b1ec8503e4fed3a3dfb9e1b84de8e4ba23ca0256	  শিৱসাগৰৰ শিৱদৌলৰ পূজাৰীৰ পুতেকৰ বিয়াৰ জোৰোণৰ কাপোৰৰ হিচাবৰ ৰচিদ।		নিজৰ 
b2dec8f1d5d7b2a831b9e30fef4cc87dbbe116faee2dcd4a253667afa8c3740b	এটা ৰাজহুৱা ড’মেইনৰ বাক্যযোগ কৰক।		মজিলা কমন ভয়চ
b304cccbde0de843df66db757ca70e6a8c346672cc519b6827193094f5438f07	মাছমৰীয়াজনৰ ই এক নিত‍্য-নৈমিত্তিক কৰ্ম।		Sentences from the Facebook group 'Oxomiyat Kotha Botora'
b311a638c7138c4d4d44b00af97f76fc1e3ac042f47f12a5f8f6aa14059291ff	কোনো কথাতে সখিৰ বাইকৰ চুলি এডালৰ সমানো আঁতৰ নহ'বি।		Assamese stories
b329c3878528a262b56e735a9e03d29d1d913f68456135d70a017a7e26a76d1b	দূৰৈৰপৰা দেখি, ঘোঁৰাত উঠি ৰজাৰ চিপাহী আহিছে বুলি ভাবি মাজত সোমালগৈ।		Assamese Novels
b357c855dd88df7aa97fe38752c6b19ac11b437a7bc3951962957e5d3838e8e2	এনে সূৰ্য্যকুমাৰ হঠাৎ সেইবিলাকৰ পৰা বঞ্চিত হৈ বিবুদ্ধি হৈ পৰিল।		???? ??????
b359772e1d8c7c9d0767ac633640c34d94502b6087780b70ed4e98641a532cce	তোৰ সূৰ্য্যকুমাৰৰ কাৰ্য্য দেখিলি?		???? ??????
b35df36a08fdd01eb152538dce32e0a897c53e41e51a91e64bafbb999417eaef	"""অইন মানুহে এইজনী ক'ৰ ছোৱালী বুলি সুধিলে বুঢ়ীয়ে ""মোৰ জী"" বুলি কয়।"""		Assamese stories
b36accac1a505fd94d715b6222849daf1b3cb180dfbac1d6a4bed3661754c63a	বতাহত দুৱাৰখনে খট্-খট্ শব্দ কৰি আছে।		স্ৱ-উদ্ধৃতি
b39a6ce45c7515358b3916d8c80520c2e111b2e7bc155439dc6de49d9e153662	কঁঠাল ক্ৰান্তীয় অঞ্চলত পোৱা যায়।		Assamese Wikipedia Articles
b3a46ac2a1f31cb1b99517979bac28dbff2b1951bd5a469548cf7f6da81a4d26	গে’মিং চেয়াৰ	technology_robotics,general	স্ব-উদ্ধৃতি
b3b48c78c409bf50ab22f07596fa6544c1bf56aefc2e36d6694f7d74afbc78ae	সেই সৰু কথাটোৰ বাবেই সিহঁতৰ সংসাৰখন থান-বান হৈ গৈছিল।		স্ৱ-উদ্ধৃতি
b3ba1582db774dd32df13a6c67037f134e0d115db85d994264d550037e143737	দয়াৰামৰ পৰা হৰহঁতে জানিলে।		Assamese Novels
b3d0be78409870f348a291b8075d3b1f15231921b2026e9118227c3510051588	সূৰ্য্যকুমাৰৰ চকুৰ লো সৰ সৰ কৰে বৈ পৰিবলৈ ধৰিলে।		???? ??????
b3d383181331969e23413353e1c35d2975297ec29e8aafc0109992e2d8c983b2	"""ভাইৰাছ শব্দটো সংস্কৃত শব্দ ""বিষ""ৰ পৰা আহিছে।"""		Common Assamese sentences
b3d6dc90dfa373ce1b8287aaaa0bae60f883f0183dba4a65dbf5fa496ead919c	সি প্ৰকৃততে এটা ব্ৰাহ্মণ পৰিয়ালৰ মানুহ আছিল।		Assamese stories.
b3dbf9477dcd6f8ae1679c0fd524b801a031a8c6f4edfc9b4d32fa75ec15550c	কাইলৈ বিহু, সেইদেখি মই মোৰ ভনীটিক লৈ যাবলৈ আহিলোঁ।		Assamese Novels.
b3ed2e46c456565e5db0eb647ff2916cc89d640e1f4eb534e4f235859801916b	ঔ টেঙা নামটোৰ উৎপত্তিৰ লগত কেইটামান লোককথা জড়িত হৈ আছে।		Assamese Wikipedia Articles
b3f5953c8ce04f7509bc2260b7cd23de29cf401d49133dc59a3d8828a0e7cc22	তেওঁক সভা গৃহলৈ ঢোলে-দগৰে আদৰি অনা হৈছিল।	general	স্ৱ-উদ্ধৃতি
b4018454d2ae81cf8138186eb346ee0a3bc4d2ebe641497eda243dcfc7728ffb	তোমাৰ বিপদে ফুল সদাই তোমাৰ লগতে থাকিব।		???? ??????
b40e93cf9c61a94924e9e03956c923818c1720c08ded2971eacd49592c191150	তেওঁৰ মূৰৰ কামোৰ, পেটৰ বিষ আদিও নাইকিয়া হ'ল।		Assamese Novels
b42a8e9c19e37a1f1d3b325a36594944fcad0e978e9d1480219497fa6296f3fa	মই নিগাৰহঁতক কেতিয়াও ভয় কৰা নাই এতিয়াও নকৰোঁ।		Assamese Novels
b4323a6a70e141d580ef05be0a932167b74c73f4f3159d8d0e08ffdd81c6fc24	এই বছৰ এপলৰ কি ফ’ন ওলাইছে?	general,technology_robotics	স্ব-উদ্ধৃতি
b443417726516013963d8cf953eff9843efe307a49c9da62b485b08b0f7a97a3	চোৰে চোৰ কৰি নিলে লাখ-লাখ টকা।		Common Assamese sentences
b45cab96e2296dc9e9464ff7911f725d57f76cbcb8efbacee30fbf773ae2ebd7	ৰজাই ঢোঁৰাকাউৰীৰ কথা শুনি অলপ উশাহ পায়।		Assamese stories
b45da8ffcb5b61729efe5acf82bdc2caa80a1f716860291a8e5932f121e4fea5	মই বেয়া পোৱা মানুহ		Sentences from Short Assamese stories
b45ea295ca8457505d8c5d55d2c113f89f022091c0e446b6e9d2f6d528346931	গে’মিং মাউছ	technology_robotics,general	স্ব-উদ্ধৃতি
