sentence_id	sentence	sentence_domain	source
86dc1eb743de579aaaba95156a1299bfa976e1acbc24877fcad9642a99e4cdff	যি ইচ্ছা তাকেই কৰি থাক।		Sentences from various sources
86f41030618de781b6799893e5cb6f32b1a6f761416e67c7cd05b379a0fc3718	সন্ধিয়া আৰু ভাত খোৱাৰ ঢেঁকীত ধান বানিব নাপায়।		Assamese Wikipedia Articles
86fa64cc48207b93993cd1345bf0f66721c7641a71ecb74d049349c1123a06a4	এই উদ্যানৰ আয়তন ১০৩.০৯ বৰ্গকিলোমিটাৰ।		Sentences from various sources.
87137a7be33669bd61b32ee734b990f85246bba4bcc9a393397b22256542fdab	সূৰ্য্যকুমাৰো সেইদৰে যি আশা কৰি আহিছিল।		???? ??????
872804132f1836aeaec4803ea95b83b628680303d520b608ca8f1a1c1d705eab	কৃষ্ণই হাতে ঢুকি নাপায়		Sentences from short Assamese stories
8740601ca58001b4d9b65341b39a1bac36f53bf30853f658811b549736716cd1	এই সকল মানুহৰ কোনাে মানুহৰ হাতে বামুণে জল ব্যৱহাৰ কৰিলে।		Sentences from various sources
875bab5fe21ff426ec502b51e8a9beeaef5285a8da518b58972a962c76213a6f	দৰা তেতিয়া গাৰুত আউজি বহিছিল, এটা মানুহে ধৰি আছিল।		Assamese Novels
8763d1391e87f23d4b37cd749a668ef81273052727dfd511d5cffcd339665e5c	"""গাত"" শব্দটোৰ অৰ্থ হ'ল-শৰীৰত,আৰু ""গাঁত"" শব্দটোৰ অৰ্থ- মাটিত খান্দা দ খাল।"		স্ৱ-উদ্ধৃতি
876abb3ad7a2d04c6d3baac01c53788cbe841e4af2f89ec8182255340fe11f8d	জিম্ স্বেলডেন বুলি মানুহ এটা আৰু এজনী বুঢ়ীকো লাগে।		Assamese Novels
876b2faec47b7c211cba5342e4277679aa4438e81c5123f6325ee7a5c2f5d126	সি ক'ত? মই তাৰ সৈতে দেখা কৰিব খোজোঁ।		Assamese Novels
8785e9d4699bf86ee69f3abee26d6eb3ec20675bf2c1b7f8b41c0d774c73f1a5	নলবাৰীৰ ৰাস মহোৎসৱ অসম বিখ্যাত।		স্ৱ-উদ্ধৃতি 
878bbe70dd1c47264c181e79de39be6396d6eb4c1781f534d60cc15d28110be2	দুজন বৰ মৰমৰ সখি আছিল।		Assamese stories
878c47ab08eee7b1d18a17d4ce70284bc9bda59038a3d7c2e6857d04ed8560ea	অনেক ডেকা-গাভৰুৰ এনে দশা ঘটে।		Assamese Novels
878dc84c5c2428a8c0773cfea68ff5182b3972a9e16f7d9cfbce92ef5afbb735	অসম নামৰ উত্পত্তি সম্বন্ধে কোনো কোনোৱে মত পোষণ কৰে।		Sentences from various sources.
878e8f0ca0e2377bf7b55fe5cc2af92482362a777b15bc1029d080a9d6799c47	গাড়ীখন অথবা মটৰচাইকেলখন পাৰ্ক কৰি মাথোঁ অফিচলৈ সোমাইছোঁহে।		Sentences from various sources.
8795ac706c42779d1181114506bc7cc87904cccd81728248e2b2892489e40457	মোৰ একো ক'বৰ নাই		Assamese books
8796f8da73b675f5eff744ca1db25a8ae7d73e83be47d5c13b72d83d1c9ba99a	স্ৱাস্থ্যই সম্পদ।	language_fundamentals,general	উপদেশমূলক উক্তি 
87ac112caace6a99432b63261f5cc019f07d86deaa6e3805fd41f584b279d1f0	এলাগীৰ এজনী ছোৱালী আৰু এটা ল'ৰা, নাম তেজা আৰু কানাই।		Assamese Novels.
87af2aed6ff0bef5f0b2ff9d706556e97c99c63624347f8fa34a94ecf37d2135	ফ্লিপকাৰ্ট এপৰ পৰা অৰ্ডাৰ দিলোঁ।		Sentences from various sources
87bb3b0927c64e7f02310ffb8399384efbe13c049951b9c8b1cd9cc38753b64c	নাখাই ৰৈ আছে।		Assamese stories
87bcc1bfa508ad5a26b5360bdfa7d6f9045b0009fb67ba6179869362142f63b4	পটু গৃহিনীসকলে উৎসৱ পাৰ্বনৰ বাহিৰে অন্য সময়তো চেগ বুজি জা-জলপান খুন্দি থয়।		Assamese Wikipedia Articles
87c748c936f7ab3ca85cddb690333db055b6cce53e0189c3917d3ab318e526f0	আটাইতকৈ সুলভ মূল্যৰ ভিভ’ ফ’ন	technology_robotics,general	স্ব-উদ্ধৃতি
87c8daf368ed5e9963421c4db57ceeb06b52e30619a44df9dec81e17779d0d1d	পৃথিৱীৰ বিভিন্ন দেশ ভ্ৰমণ কৰা মোৰ জীৱনৰ লক্ষ্য।		স্ৱ-উদ্ধৃতি 
87da2c0fbe22ff5c71f1d5074baf5c80fa2252785b556b1338ca3e6a7b4ffbb7	আৰু ভাবিলে ঈশ্বৰৰ অনুগ্ৰহত দুখৰ পৰা তেওঁবিলাকৰ উদ্ধাৰৰ বাট ওলাল।		???? ??????
87e2d9fb1a5c0202c52183c22284bfab0e35e6e7f668be0cd71149209e67f229	"""দুখ আৰু দোষ"""		স্ৱ-উদ্ধৃতি
87eff8b336f6166836d3b1fe5a7c2945b863a807e663a1a772bf2889a0a04c52	তহঁত তিৰোতাবোৰৰ যদি অকণো বুধি আছে।		Assamese stories
8814e0d725455a5929796727fd180d7f35139b0ddca2d8fc24a2f507ed713483	ম’বাইল ফ’ন-সম্পৰ্কীয় বৈচিত্ৰময় গুগল সন্ধানৰ প্ৰশ্ন ইয়াত দিয়া হ’ল	general,technology_robotics	স্ব-উদ্ধৃতি
882b33e59c34e7714c2e25e397309cc40fbbad14f89bcc305bd729f41fb0f2b0	জোপোহাটোৰ ভিতৰত কিবাহে ফোঁচ্-ফোঁচ্ শব্দ কৰি আছে।		স্ৱ-উদ্ধৃতি
883d3ee79cfb795581516b9544fa4b2e5b4bd70e49daa200e45e58b9f23bcb66	কম দামত ভাল ৱায়াৰলেছ কীব’ৰ্ড	technology_robotics,general	স্ব-উদ্ধৃতি
88410ca5ce9302da987d572e5bd8e8230b8e22df2b7383db622674450c175ddd	গুগলৰ ফ’ন	general,technology_robotics	স্ব-উদ্ধৃতি
884724bea832c2c1c61b03e09f2805d8a5e93303a98eaae3f7f64369ac7423c6	সেইবো দেখিলে সখিলৈ মনত পৰি ধমধমকৰে আমাৰ বুকুত জুইহে জ্বলিব।		Assamese Novels
8849d34d67eb858be222d4031ee01dabdebcd2247fcca52ce7bb7a89856db4f2	মোৰ হালধীয়া বৰণত আখৰো টৰ চাল ঘঁহি অলপ ৰঙচীয়া কৰি লৈছোঁ		Assamese books
8853c2c3038eeeb24e309f3189872e37b5717236c7edfe80f92b8993afec0dda	ৰিয়েলমীৰ দোকান ক’ত আছে?	technology_robotics,general	স্ব-উদ্ধৃতি
8856cdcd49b712a9d266031aad7bd5170227d84a5926c75b73f588053795d441	কিয়বা তেওঁ ৰাতি পোৱাবৰ আগেয়ে হাতযোৰ কৰি কাতৰ হৈ ৰাতিক নুপুৱাবলৈ কাকুতি কৰিছে?		???? ??????
885e1380c73cc798ca51df78bd338e1af302ea7b03f35f0dc92b724124ae740f	বুলিয়েই আপোনাক চাইকেল এখন দিলে সেইখনেৰে আপুনি ঘণ্টাত আশী কিলোমিটাৰ বেগত যাব পাৰিব জানো?		http://www.xahitya.org/2019/09/22/%e0%a6%b6%e0%a6%bf%e0%a6%b6%e0%a7%81%e0%a7%b0-%e0%a6%ae%e0%a6%be%e0%a6%af%e0%a6%bc%e0%a6%aa%e0%a6%bf%e0%a6%af%e0%a6%bc%e0%a6%be-%e0%a6%a1%e0%a6%be%e0%a6%83-%e0%a6%95%e0%a7%81%e0%a6%ae/
887cad7b2a8e78df2baf69ba24784dccfdc882640f70eb02db3701f87be491b3	গৰু গাই কেইটা ওখ ঠাইত বান্ধে।		Assamese stories.
88a3846780ba37566bf61a6baa867896cbd89b33b92cef6313629b243df042dd	"""হঠাৎ তেওঁ ""সূৰ্য্য"" ""সূৰ্য্য"" বুলি দুবাৰ অতি কাতৰ স্বৰে মাতিলে।"""		???? ??????
88a8662997ebc0f1733d4571b00082b86ce266b3cae7fc716109c5a77978aefc	কেঁচা জলকীয়াৰ কেইবাটাও ঔষধি গুণ আছে বুলিও বিশ্বাস কৰা হয়।		Assamese Wikipedia Articles
88c2d9bbdbbaa8a9cfea9dd336e471c900452c9ce99f6e46b6683f7e5ad9cd5b	ঘৰৰ ভিতৰ বাহিৰ চাফ চিকণ।		Assamese Novels
88df998e5d7862e6e22c3f1e6f6ee6c929af18a671ddf3185ce47e625764b344	খুজিছে মানে টানি নিলেই।		Sentences from various sources.
88ede9b190ce380da03d9c1a938b4e7a847b36e72ea3123f28739e36b8921fa9	বাংলাত বকুল ফুলৰ বাবে পৰিচিত এই গছ।		Assamese Wikipedia Articles
88f4bd5b9964f12510e58b6945c6885662d1e9679a42a9fa468bdd4c889c2b83	ফুলবোৰ সৰু,বগা ৰঙৰ।		Assamese Wikipedia Articles
88fbc8334e96c011ee55318e2592698d0a9fb9b87f9cb0e56b00e26d2db76efc	ঠেলা খাই টম্ পৰিল তিৰিশ ফিট তলত।		Assamese Novels
890d64b0b152ba5acc5a44241aa9b4a3f08f93ba71aea91fa54021ee37aa3ca3	এয়া ষাঠিৰ দশকত কৰা ষড়যন্ত্ৰৰ প্ৰতিফলন।		স্ৱ-উদ্ধৃতি 
891b60bf6a1c266f1d552625b029295bc0afdc1abebc64fae6207bccbff07b2a	 শক্তিশালী সৌৰশক্তি 		নিজৰ 
89227bb5f27382e74c9e9b023be2e5e9f7e737fc9a06bd5ef9f7fd0520d3d1f9	ওচৰ চাপি আহি কোৰখনেৰে চাব মাৰি দি বাঘৰ নিজডাল কাটি দিলত বাঘ ৰক্ষা পৰিল।		Assamese stories
892385a97cf941c75ec581bb5caa5c2f1932919591dc96e84b2b9d0d68d16983	সেয়ে ধৰ্মশাস্ত্ৰৰ লগতেই মই ডাঙৰ হৈছিলোঁ আৰু শিকিছিলোঁ।		Sentences from various sources.
8926362502c402f8be3647fccc8ad83da470387c30cbd5e5fb48e090874bea3e	এখন দেশত এটা কুমাৰ আছিল।		Assamese stories
8931a8f8c5db48e2d66bc468fb11ed953d9290d5eb36db6ac98668c0618b946f	সিহঁতে আহি পোনেই মানুহটোৰ গাত হাত দি দেখিলে যে তাৰ নোমবোৰ উঠি আহিছে।		Assamese stories
8948f68fafc6e54649a9f870fc62ad005000363d66df25fb2856fa80dc3e952e	বহু দেৰি হ'ল; এতিয়াহে যোৱা?		স্ৱ-উদ্ধৃতি
894d9db660788db4994a3426576830c5f5a76ae657a59c81b020d29959e21e77	আৰু কাৰ কাপোৰ ভালকৈ বোৱা হয় মই চাম।		Assamese stories
89625f846000c559f73e66fa4d4d8a14531343bfb11dbc6d8e546303e72e70e5	সময়ত তোমালোক আহিবাহঁক।		স্ৱ-উদ্ধৃতি
8964c96ae383e4b6dde82c3005eff7b09204abe076edf7c993ad061fda274a63	আৰু পানী নানিবা আৰু প্ৰভূ!		Assamese stories.
8969c97a57349b76415593471a86c9675e3bf4283a3ef95c164807ff9ad12e89	ৰোগটো নিজৰ হিচাপত বাঢ়িয়েই থাকে।		http://www.xahitya.org/2019/09/22/%e0%a6%b6%e0%a6%bf%e0%a6%b6%e0%a7%81%e0%a7%b0-%e0%a6%ae%e0%a6%be%e0%a6%af%e0%a6%bc%e0%a6%aa%e0%a6%bf%e0%a6%af%e0%a6%bc%e0%a6%be-%e0%a6%a1%e0%a6%be%e0%a6%83-%e0%a6%95%e0%a7%81%e0%a6%ae/
896f8b5f9c809e1c10bf092c078f051486fc785f01871b74fd1484b837b6a623	হয়নে; তুমি বোলে ছোৱালী পলুৱাই আনিলা?		স্ৱ-উদ্ধৃতি
899303406e5b5c816180e7192ff72f1e3b5bc3ffb745ecec1c5b13e5912cd2fa	এ’চাৰক কেনেকৈ যোগাযোগ কৰিম?	general,technology_robotics	স্ব-উদ্ধৃতি
8996e2bef58e8663433189c7a8371bb2d203a2d69147b4062e9c4f94c6eab1ec	মই বুজিবই নোৱাৰিলোঁ যে কটাৰ-পো মোনাতে সোমাই মোৰ কান্ধত উঠি আহিছিল।		Assamese Novels
89a5f43e56505b7ab43a366720c83e55304ed84c0272c17a448d360e4149c345	এই গেলা গৰমত মোৰ সুবিধাৰ বাবেহে মই বটলটো আনিছিলোঁ।		Sentences from various sources.
89b1a2c2c69bb3d5731ca60f71528ac1a4dc12fb37ca77792c8c217223681a3f	যতে শুদ্ধ প্ৰণয়, ত'তে এই কাণ্ড।		Assamese Novels
89b5527ea45f424d05024327b9486dd562c7806220fb729996966f45ef74030b	অহাৰ পৰা আৰু সি ঘৰলৈ যোৱা নাই।		Assamese stories.
89b9d196583623ca0460fbdd2e10430709093071bed939269e15231e988528c3	দোকানত থকা মানুহ কেইজনে কথাৰ একো মোৰ ধৰিব নোৱাৰিলে।		Assamese Novels
89bcb9d8ab01db38814a3cfd746a9f114fadea6a02b4ca74905f32986cd53e4d	আৰু একেবাৰে গা খালি হ'লেহে আহিম।		Assamese Novels
89c0e597508ae5626106fc4b7c794f34e5d688b1c5ad2074c2b089c14910b61f	সংযুক্ত মহাৰাষ্ট্ৰ আন্দোলনৰ স্মৰণত ফ্লোৰা ফাউন্টেনৰ নামকৰণ কৰা হয় হুতাত্মা চক।		Sentences from various sources.
89c131dd8c542068a9ab279e53610a48a730278e46bd29f199832b0ec02d938e	ঈশ্বৰে এনে কাম আমাক কৰিবলৈ আদেশ কৰা নাই।		Assamese Novels.
89c8822adc9923198b9a160390bc634f4945b09820301f24b1ce23464cbbfe0b	তেওঁ দেখিলে এজনী দীপ্‌-লিপ্‌ ছোৱালীয়ে ডালতে বহি চুলি আঁচুৰিব লাগিছে।		Assamese stories
89e3bc016be665ad7721c323eb49e1ffe5091e254432b947b3c415573546537d	আন এচুবুৰিত চাৰি পাঁচ ঘৰ ব্ৰাহ্মণৰ বসতি আছিল।		???????
89e928644de82f0e501139d585a73d63020b9fb39ecb0c75abee7e217d00ac41	এই সুমথিৰাটোৰ সোৱাদ অতুলনীয়।		স্ৱ-উদ্ধৃতি
89ee8c64bfe07fd8d84920bf89071e6192259af1c3376af9adcd2e9dc0ccedcf	ছোৱালীজনী দেখিবলৈ নাপাই মোৰো মনটো সদায় হমহমাই আছিল।		Assamese Novels
89f27aac645a830269b7833c8b9f6e889df0bbf454561c4bab68abcd35397260	বাকী পোন্ধৰ অনা তেওঁক ধৰোঁতে পুলিচে কাঢ়ি লৈছিল।		Assamese Novels
89f8a9b30e8a296ef6b09dab9c5e634c4feb4650c3b75a43b438be17e295959f	কিয়নো, মোৰ আশাৰ কোমল পুলিটি বাহ শত্ৰুৱে ধৰি উভালি পেলাব।		????? ??? ??????
8a060d7893d6d78774ccb013e702aa99a7d312530870ef78f33f9589f5bb4804	গণকৰ হতুৱাই নাম চোৱাবলৈ এজন গণকৰ ঘৰলৈ গ'ল।		Assamese Novels.
8a0a716202a4c2286a96d0dec9caaed3b90a2d48ff3e378b75e3e269974bd0e7	তই গম পাওনে?		Sentences from various sources
8a0aab5b7cef0afdcec9992e69dc92385191e5665c97a9cd205995a7bf95b98d	থানে আৰু ৰায়গড়ৰ সীমাত বোম্বাই চহৰৰ জনসংখ্যাৰ চাপ কমাবলৈ।		Sentences from various sources.
8a1225b77646919486445eeef3621037b6d1fa1595f8fbd1357e5df8065bcc85	চছমাৰ পৰা মুক্তি পোৱাৰ উপায় কি?		http://www.xahitya.org/2019/09/22/%e0%a6%b6%e0%a6%bf%e0%a6%b6%e0%a7%81%e0%a7%b0-%e0%a6%ae%e0%a6%be%e0%a6%af%e0%a6%bc%e0%a6%aa%e0%a6%bf%e0%a6%af%e0%a6%bc%e0%a6%be-%e0%a6%a1%e0%a6%be%e0%a6%83-%e0%a6%95%e0%a7%81%e0%a6%ae/
8a1d121f7be835d3b5be4a28ba8282917ebf65b5fbbcdff060ead8675598ae38	তুমি যদি সচাকৈয়ে ভাল দেখিছা, কৰা তোমাৰ মতেই।		Assamese Novels
8a26d8b642a4878a76352f3ae2287fdc80c34e36c8106cce8754b401748108b3	সংৰক্ষিত এই বাবেই যে দক্ষিন		Sentences from short Assamese stories
8a4142dff540441e61de712533dd11f49eb80a223fd2f640b495774b37ab525b	কেৱল সলাকানি ডালৰ আগটো কাটি বঢ়াই দিয়া হোৱা নাই বাবেহে তেনেকৈ সি কলমুটিয়াব লাগিছে।		???? ??????
8a4350ab999a98522d8586d5710a5393e24bf8b5f777a4d0d07e449e4414edb2	ইয়াৰ ভিতৰত তেওঁ কেতিয়াবা দেৱালয়ৰ প্ৰসাদ খায়েই কটাইছিল।		Assamese Novels
8a4800a9c4e7301c8ffc00c1f919f934d46d2e42fe2fa846df8645df7d8b5b76	কিবা অলপ লাগিলেই ঘৈণীয়েকে চল চাই টোপোলা-তাপলি বান্ধি মাকৰ ঘৰলৈ লৰ দিয়ে।		Assamese Novels
8a49e6bdc77c699458f6fcf2625c54e4a754e9f754856b4759c4a207700fd812	চাৰিউফালে ভয়ানক ৰন-বিগ্ৰহ বিপদ, সেই বিলাকৰ মাজলৈকো তই যাবলৈ সাহ কৰিব পাৰ নে?		???? ??????
8a4cc919af9cad63d46eafa453061f2a96947953bf37e8a9af79483d59153820	সাহস আছে যদি কথাটো দেউতাক কোৱাগৈ যোৱা।		স্ৱ-উদ্ধৃতি
8a5a3666c7cd53317e7d1deea542d0666889b621b6b071f170c21ed915a8f0b8	ভূঁই ৰোৱা, তাঁত-সূত বোৱা আৰু আন ঘৰুৱা কামত মাকক সাহায্য কৰিব পাৰে।		Assamese Novels
8a5a9de78f5154dc6259a75e30822f3b9219423f2a4511bf36a6761bc8dedf7d	এতিয়া চোৰক দিবলৈ আঢ়ৈ হেজাৰ টকা ক'ত পালে!		Assamese Novels
8a65957c1ddb3184d4a7e7d79af27a3607b220d5582dfe23e670063a2b6c1689	বাধা দিলেও সিহঁতে সেইবোৰ খাবই।		স্ৱ-উদ্ধৃতি
8a7815a5135e8259a2ffe0aff825014db9c16b9450433acbebdadac351ef8c9f	পৰ্ব্বতৰ সিমুখে থকা ভৈৰবপদৰ ওচৰত বাবাজী এটাক ভাত ৰন্ধা দেখা পাই পুলিচক জনালে।		Assamese Novels
8a7ce00926d13fcd1cc5d4ebf0e09c2abcded9d5e38b87944f5e810bb1faf495	তেওঁ এতিয়া যাওঁক দে।		স্ৱ-উদ্ধৃতি
8a7eba0b881f45821e1578546688af1e05d75fa94796b264c73e8bba91664bf5	তাৰ বিশ্বাস মই আগলৈ হিড়িম্বেশ্বৰ মৌজাদাৰৰ মৌজাৰ সমান এটা মৌজা খাবলৈ পাম।		??? ????-?????
8a824dfb4a143fb5795f125b70a5432fff27b126b32a5130479d925aad22cf5b	এইবুলি কোঁৱৰে ক'লত কাউৰীটোৱে বঁৰী-কোঁৱৰক পকা আমটি দিলে।		Assamese stories
8a95898850889ff57fc42ab10f7bb3795674c43c5666a29ce4974e82d5095c31	সাজ-পাৰ আছিল এখন ধুতি, এটা কামিজ তাক এখন এৰীয়া কাপোৰ।		Assamese Novels
8a98da3228ed992ca863dbccb6fd757db8e25f0bbac88ba1655ee159da58f60e	ক্ষমতা দখলৰ বৃথা চেষ্টা।	general	নিজৰ 
8aa7d54080d71e9a7d36e76835692247e7edd65d2abaff067b8f8f07d75ba418	দুয়ো দোকানৰ পৰা ওলাই গন্তব্য স্থানলৈ খোঁজ ল'লে।		Assamese Novels
8aafa3f080f4535d658bbdfb57a41b65a673d678463fb8d60c1bdd4c2c3b1e03	সূৰ্য্যই পদুমক এৰিলে পদুমে কি লৈ জীয়াই থাকিব?		???? ??????
8ab67a335858a553678a1520dcd8b5071ba1dff4f88041daa127697b931cd1ab	এইবাৰ আমি ডিজনীলেণ্ড ফ্ল'ৰিডালৈ যাম।		Sentences from various sources
8ac430614b1019bb577a906b55731c22854b7a41ac54c73d7fc668db10637d62	শ্ৰেণীকোঠাৰ শেষৰ শাৰীত বহিলে আপোনাৰ কণমানিটোৱে ওচৰৰজনৰ টোকাবহীৰ পৰা লিখিব লগা হয়?		http://www.xahitya.org/2019/09/22/%e0%a6%b6%e0%a6%bf%e0%a6%b6%e0%a7%81%e0%a7%b0-%e0%a6%ae%e0%a6%be%e0%a6%af%e0%a6%bc%e0%a6%aa%e0%a6%bf%e0%a6%af%e0%a6%bc%e0%a6%be-%e0%a6%a1%e0%a6%be%e0%a6%83-%e0%a6%95%e0%a7%81%e0%a6%ae/
8ac6c26169b7109ee54ef6955868f7c434b22cf787b1649ac555ee93bf5ee102	পদুমে ঘোষা পুথি সামৰি থৈ ঘোৰ চিন্তাত পুনৰ নিমগ্ন হোৱাৰ কথা আমি কৈছোঁ।		???? ??????
8aceb80f4fefd519c121190dbb35e1b786366629031fa8d14b674ddea0180d84	 গৰমত কাম কৰি কৰি শ্ৰমিকসকল ভাগৰি পৰিছে।		স্ৱ-উদ্ধিতি
8ae00bfa327be9f5baf98fd68a0c98cd4b0cc098e9e191fcf289a39383c3be55	দুচকুৱেদি অশ্ৰুৰ বন্যা বৈ আহি এটোপ এটোপকৈ মোৰ থালখনত পৰিব ধৰিলে।		Assamese stories
8ae18369593064bc3a0c003978ffe3f637becaa899014ccd0fe229d8277e82c9	মোৰ ওচৰৰ এইচটিচি-ৰ শ্ব’ৰুম	general,technology_robotics	স্ব-উদ্ধৃতি
8aed6aa0c9500ab51b82c434ca2ceb6b72f00b91566f2b9fa7846a041d87f780	জীয়েকক চিলনীয়ে সুধিলত জীয়েকে ক'লে।		Assamese stories
8aef07bb8a6d27484b062d01f0ee0298b0bd907cc542643ccca89a554971750e	মোৰ আগলৈকো চাবলৈ নাই, পিছলৈকে চাবলৈ নাই।		Assamese stories
8aef7a83bc6b45eefa24116c539e3e51e3dfbcc621169b3556a4b7a44a6fc49d	মই ইয়াতে শাহুৱে যি দিয়ে, শাকেৰেই হওক বা শোকোতাৰেই হওক, বিহু খাম।		Assamese Novels
8af4c6da0853010f0ee0d6f7cf8890daa1a8dcf0700f44d81650fb37b0e13d47	হৰিণাৰ মঙহেই বৈৰী।		অসমীয়া ব্যাকৰণ 
8afa7a3d9d37b59d66ff6285fa30cd1d7312e43919e440df980469f03a2589a7	এইচটিচি-ৰ ফ’ন	general,technology_robotics	স্ব-উদ্ধৃতি
8b053a0b761dd89ebdd2d1f090d91f5f37ed0091e381365ec5864be887d19cf6	আপোনা ভালেই জগত ভাল।		ফকৰা যোজনা
8b16e70b38ed02dade78826a4eff8e2386250339b11b3ef7b129e17278538731	 ক'ডিঙৰ নীতি-নিয়মবোৰ বা নিৰ্দেশনাবোৰ কম্পিউটাৰক চফ্টৱেৰ অভিযন্তাই প্ৰগাম কৰি শিকাই থয।	language_fundamentals	সাধাৰণ জ্ঞান 
8b1d4b7a271ce637b16ee7a36a845ec1163412e171ce24f27c7d8ba5fcdfc974	ছোৱালীজনী আতি মৰমীয়াল আছিল।		স্ৱ-উদ্ধৃতি 
8b26431c15b79dc86e8931653c564cf0a757e5fecd3cb1d35befcd34afcf6802	তাৰ পাছতেই তাৰ ঠিকনাৰ আউট পোষ্টলৈ ফোন কৰি তাৰ মৃত্যু সংবাদটো দিছিলোঁ।		Assamese stories.
8b30411cc69d6c7908393d49af5520cac87e5d52f54e1061989df3eb9f9b4307	হৰদত্ত য'ত, পদুম তত, গতিকে হৰদত্তক নেপালে সূৰ্য্যৰ আশা বিফল।		???? ??????
8b37d08b92a0225b2a8eb6e8347f7574c8f51bce57c29be1c4a3f204e8e82b33	ইমান ডাঙৰ প্ৰজেক্ট, মই যাব লাগিব।		Sentences from various sources
8b37dcbb9e1993633367acb9414932c9eacfcd4f91ad0c7a03944972a2670943	ভাৰতত বহু ঠাইত মহিলাই অংগ প্ৰদৰ্শন কৰা দূৰৰে কথা, ঘুঙ্ঘট লৈ তত নাপায়		Sentences from Short Assamese stories
8b45af4331ac075b2e988e32b306967b00ed50a3d5f71e6d9ebbf06805a5b6e3	মুঠতে তেওঁৰ টকা আদায় নহ'ল।		Assamese Novels
8b45fcb92dbf99dc2549f484086b79e688819af52f595f717d0768f25ff54e5c	আপোনাৰ শিশুটিয়ে দূৰদৰ্শনৰ পৰ্দাৰ একেবাৰে ওচৰলৈ গৈ টিভি চোৱাৰ অভ্যাস কৰিছে নেকি?		http://www.xahitya.org/2019/09/22/%e0%a6%b6%e0%a6%bf%e0%a6%b6%e0%a7%81%e0%a7%b0-%e0%a6%ae%e0%a6%be%e0%a6%af%e0%a6%bc%e0%a6%aa%e0%a6%bf%e0%a6%af%e0%a6%bc%e0%a6%be-%e0%a6%a1%e0%a6%be%e0%a6%83-%e0%a6%95%e0%a7%81%e0%a6%ae/
8b55cb32da6657d8327b40fb801f9fb4b289b66e9772d047f532a4b643a23c7d	ৱানপ্লাছত কি কি আছে?	general,technology_robotics	স্ব-উদ্ধৃতি
8b63855ec4df00ef0b251998a0896aa368927dfc41ba5501482c9e44f7491b04	খাদ্য হিচাপে সোৱাদ যুক্ত হোৱাৰ ওপৰিও শাক-পাচলি অনেক ঔষধি গুণেৰে ভৰপূৰ।		Assamese Wikipedia Articles
8b709bfb40f7146e2b9f81b972c5af577f876b36f3e1bc0b267210d53261059b	নীৰস পৰ্ব্বত শুকাই টান হ'ল।		???? ??????
8b75fda791d88192202ae612d1a6b7825f9a0bea817555feb161ec7f9623b563	চাৰিটা ল'ৰাৰ ভিতৰত ঈশ্বৰে নে এটাও এৰিব নাপায়নে।		Assamese Novels
8b77d9b21e9588a4c0db3347feb8be33471781219204275e039183d6eb9ffc1c	দুদিন পাছত এজন ডেকা ল'ৰাই গাড়ী ৰখাই আহি লেগ্ৰীৰ ঘৰৰ আগত ৰ'লহি।		?Assamese Novels
8b963ee82da6ef41bae1f4397a6e3c75756e7c5b619b949893a3f137559a383c	সিফালে জোঁৱায়েকে গোহালিৰ পৰা ওলাই ঘৰলৈ উভতি যাবলৈ বাট খেপিয়াই ফুৰিছিল।		Assamese stories
