sentence_id	sentence	sentence_domain	source
00797b30f895984a4d251f8a9101e0a2d6e8f379de7dab86f8c6233c702e9bda	শৰীৰ আৰু মন ভালে ৰাখিবলৈ হ'লে দিনটোৰ ভিতৰত এঘন্টামান শৰীৰ চৰ্চা কৰা উচিত।		স্ৱ-উদ্ধৃতি 
00e7bce1e5f8803de3e98adcd87b5cf3008b3eb80f0e9767021a23f7f9ca16ca	অতীতৰ বোম্বাই এখন শান্তিপূৰ্ণ চহৰ হলেও বিগত দুই বছৰত চহৰত সন্ত্ৰাসৰ ঘটনা বৃদ্ধি পাইছে।		Sentences from various sources.
0350e39248958378c12c90d9df2bb81762fc0518ec5c100da7ebf7e0f2648d57	মানুহজনীযে তাক তুলিবলৈ যত্ন কৰিলে, কিন্তু নোৱাৰিলে।		Assamese Novels
03abc7901ae5863302a7cda14bf93afc3779c4c6ee9503b92e4e6b0bd4d3b414	সিহঁতে শিপাৰেও খায় পাতেৰেও খায়। শিপাৰে মাটিৰ পৰা ৰসটানি লয়।		https://as.m.wikisource.org/wiki/?????-????/??????
05fa2c44c21c251432462c15a1ed353e9ca22c59d5222157dc8f810fdab2707f	মোৰ ভোক লাগিছে, হেৰ কিবা আছে যদি চাচোন মই খাই যাওঁ।		Assamese stories
06ad7c5284e340031571089483a2082c4437d42901c685386967be6c1651c89b	সাক্ষী বাদী লৈ চাব-ডেপুটিয়ে কথাটো সচা বুলি প্ৰমাণ পালে।		Assamese Novels
08ff64c9b1b212cadbe42fbdd3fad9039170663b473018aa3b5617fcdbfc9f23	তেতিয়া উকিল জনে কলে “তেনেহলেনো তোমাক কি লাগে?”		https://as.m.wikisource.org/wiki/?????-????/????_???_???_????_????_??????_??????_????
0b136f15ba8ebf2b559b83b97b2959d31d5283d3b2025dcee499dc0396d76547	যতে এইটি হয়, ত'তে মিৰি জাতিৰ ডেকা-গাভৰুৱে স্বৰ্গীয় সুখ পায়।		Assamese Novels
0b84d361740ba977c57f528cefbe2b7ac6ff8a01e5563a2f3dad3d8001853a27	আসাম অথবা আসমৰ পৰা উত্পত্তি হোৱা।		Sentences from various sources.
104e8297f8e77800c18e30ab72c6a22c8ecc205013ff7cf46bdc9f4c6c6b4acc	টিন-এইজাৰ ছোৱালী বিলাকৰ কাৰণে অসহনীয় হৈ পৰে এনে দৃষ্টিবোৰ		Sentences from Short Assamese stories
1051ae8af6a08ebe9a27eaaafeb347d0013514c0a2bdf470c8ec776eb6ffdd67	"""ঠোঁট-মুখ চেলেকা""ৰ অৰ্থ হ'ল- ইচ্ছা কৰিও লাভ কৰিব‌‌‌ নোৱাৰা,বিফল হোৱা"		স্ৱ-উদ্ধিতি
10888b504f2d04221979a070c7248599392627bcd963b8280072557d8f68ccb6	দিন বাৰ ঠিক কৰি আমি দুয়াে বাৰ চহৰৰ ভাওনা চাবলৈ গলো		https://as.m.wikisource.org/wiki/%E0%A6%AA%E0%A7%83%E0%A6%B7%E0%A7%8D%E0%A6%A0%E0%A6%BE:%E0%A6%95%E0%A6%83_%E0%A6%AA%E0%A6%A8%E0%A7%8D%E0%A6%A5%E0%A6%BE%E0%A6%83.djvu/%E0%A7%A7%E0%A7%A7
10f975a061933cc7b4f9f6a231cbf5bf651e50805d3bead414edc62b86f6923d	কেকেটুৱাই তামোল খায় নেওলক বান্ধি কিলাই।		ফকৰা যোজনা
1740917b2843067495f5ab6a5b7c1944ea1991ea394c02e166181a169c35c7f3	যিদৰে আমি কোনো পুৰুষে কি পিন্ধিছে সেয়া চাই নাথাকো		Sentences from Short Assamese stories
1832f443a53d454843d9b9aefcdb7a7c6dd28baafb3efcb6ca851c2e255fe48c	??????? ????????????? ??? ???????? ???? ????? ???? ????? ??? ???? ???????? ???		Alcohol and Narcotics Free Assam
193aa83c4693a140694a9bee92d9cb1227c23a11b92c99d0d5ad53eceee9b1d7	সমুহ-সমৰ 		স্ৱ-উদ্ধৃতি
195c78263cae89ec581b15ad87be3506a25f67e9b5977841e7f930a1e3af65ff	তাৰ সতে বহি কথা পাতো।		Assamese stories.
1a8d4a4fa9c9bd10c18d50d34b81bbf052ebb968fd275160ffafbc5c58ca6f0f	"আমি ""সহ্য"" শব্দটো ""সজ্য""ৰ দৰে উচ্চাৰণ কৰোঁ।"		স্ৱ-উদ্ধৃতি 
1a95baf7f520d5262f50c91c89ddceae192579ad89bf76aff67f7df40906d32c	সেই দেখি কানাডাৰ আইন মই গ্ৰাহ্য কৰিম, সেই আইন মই মুৰ পাতি ল'ম		Assamese books
1ba89d5a3114b83306e28356f2f015cad815f6c35ccf0d7a7344a81237f86c19	সেই দেখি তেওঁও সেই অৰণ্য বাস এৰি ছোৱালীটিৰ লগত থাকিলহি		Assamese books
1ea40038067c80c8c8b2dfc865de89197adb87eb289a068b5417409318075aa4	ডেকা বয়সত কাম-বন নকৰি এনেয়ে অনাই-বনাই ঘূৰি ফুৰিলে ভৱিষ্যত জীৱন সুখৰ নহয়।		স্ৱ-উদ্ধৃতি
1f49baecc246de8ba496ab404607d25a35459623ca541cd3245b05e09143e9bd	চুৰাটৰ চুক্তিৰ পাছত চেলচেট আৰু ভাচাইৰ উপৰত ব্ৰিটিছসকল আনুষ্ঠানিকভাবে অধিকাৰ অৰ্জন কৰে।		Sentences from various sources.
1f56196cc4be8ecdff3ab9011639118d487c853b2f377339cd39d2bbc53f6c8f	তাৰ শহাকণীয়া স্ৱভাৱৰ বাবেই সিহঁতৰ ঘৰত আজি চোৰ সোমাব নোৱাৰিলে।		স্ৱ-উদ্ধৃতি
1fed9cf6f64c6641fa80481e47dda50784c065a7cba3e5c3afb89a199a79ee37	মুখ দেখিলে ঘৃণিত জাতি বুলি জানি কিন্তু শোকেৰে ভৰা মুখ খনত কি সুন্দৰ জ্যোতি।		Assamese Novels
201b711e0f7897500d8a1b4e4cb5d5f867625745dc36b931d99730a143206fe6	সেই যে লিখনিটোৰ আৰম্ভণিতে ছোৱালী জনীৰ কথা লিখিছিলোঁ		Sentences from Short Assamese stories
20c8acc969281c60ad8f45dd545a2c3f8fb35f4fd94f313e28bf31a4fab4bfed	শেষৰ ফালে সমুদ্ৰোত্থিত ভূভাগ নাৰীমন পইন্ট আৰু কফ পেৰেডৰ বিকাশ ঘটোৱা হয়।		Sentences from various sources.
20ec2885d575c05159b1b617b7e54f7d56589e34917abbc5ecb5c5410a532e1f	তুমিচোন পালাহিয়েই!		স্ৱ-উদ্ধৃতি
21fe187de255e375dbc9e779aaa266170ad4c1542b6053c9a55ec3b221d2bab1	তাৰ একো চীন-চাপ নাই।		Sentences from various sources
2256295bf7bfda2e25dc9453c9f1fb7504afde037aa6b6703d462a466b1bcb9c	গাওঁ এখনত নঙলাৰ দৈনিক জীবনত তাৎপর্য্য জানিবলৈ পাই		Sentences from short Assamese stories
22f8ea1c2f57d86448bc1d99289e3dd5e89deb3027d8aa9ca00f277d15262c17	জুৰিতিৰ ওপৰত কাষৰ গছ এজোপাৰ ডাল এটা ওলমি জুৰিটীক আবৰি ধৰি আছে।		???? ??????
235fee5398b785d540dbb9d56fa6cd58a55df3078cfaff2076c320e9e3e868bc	কিন্তু কিছু দিনৰ পৰা অসমীয়াটো এনে ধৰণৰ লিখনি পঢ়িবলৈ পাই		Sentences from Short Assamese stories
23bf494cc3fe8612574b6f1fba15efa9b18e9b02c810f070420f487272c5cf93	একাধিক ঐতিহাসিক স্থান আৰু গুৰুত্বপূৰ্ণ হোটেল ভীষণভাবে ক্ষতিগ্ৰস্থ হয়।		Sentences from various sources.
23e8ae20c3aaeeea37be449dab3db45b3aa74042016234b7351aa51c1cfc985e	ভীমদেবে গুজৰাটৰ সৌৰাষ্ট্ৰৰ পৰা মাহিকাবতীত য'লৈ পাথাৰে প্ৰভু সম্প্ৰদায়ক এই অঞ্চললৈ লৈ আনে।		Sentences from various sources.
2678661d5249ff6d2d360779ea20b3081ddbd8c325549a8096c21a459f620b75	মোৰ মনত উদয় হোৱা এটা প্ৰশ্ন আপোনালৈ আগবঢ়ালো।    	general	নিজৰ 
26b01ebfca6060455eb5fcbb0ed48cda2cb1a9b660a7153fb8e12b19ec665a60	আমি দুই ভায়ে মৰি মজি কিষ্ণক যিমান পাৰো সিমান সম্ভেদ ল'লো।		???? ??????
26c09f71181118ec55b585cc4f815816f29d881f20ccddb3d5408102b3b69e7a	গঙ্গোত্রী, কেডাৰনাথ আৰু বদ্ৰীনাথ দৰ্শনৰ এক নিয়ম আছে বুলি মই তাত গৈ গম পালো।		Sentences from the Facebook group 'Oxomiyat Kotha Botora'
289ed64e1ad37e12ecae0e4ca4f0fa8589e234998d5c7e72d5ff7ca90c00f21d	এই মুকি ফুলৰ মুখখনি ধৰি ফুকনে চুমা এটি খাই মূৰটী শুঙিবলৈ ধৰিলে।		???? ??????
299b5919b5ef5e1d1ea2b1583972f40908fc918b7306135089c2c567965a637b	ইমান মাতোতেও তুমি দেখোন নাহিলা।		স্ৱ-উদ্ধৃতি
29b2ce888908b8914c7bf1b99e0f9884a3e7d9f31885a125a4085f3e2bd21b01	বাঘ,সিংহই গুজৰে।		স্ৱ-উদ্ধৃতি 
29c3c6640207d66aa6fa512c97ece0621e205cf6d2eea2f2d8d79494991d531f	তুমি ভূপেন হাজৰিকাৰ গান শুনিবলৈ ভাল পোৱা নে?	general	স্ৱ-উদ্ধৃতি 
2a61c33335469635f0c2ef52f59cc36e4965489ef5a44201012ef8690ffdcbcb	 বিশ্ৱ স্ৱাস্থ্য সংস্থাৰ সমীক্ষামতে।		নিজৰ 
2ac446e22caa797be70caef210e5afc571143087d9469e1f2bb4b2c3aef78371	আজি পাঁচ বছৰৰ মূৰত দুইও সৰ্ম্পূন ডেকা-গাভৰু হৈ উঠিছে।		Assamese Novels
2cffa0a1d83e115851c5cc70804988ac88a43bf8bf6a6c1c71d581e6d623326f	চীন দেশখন পৃথিবীৰ ভিতৰত শক্তিশালী যেন অনুমান হয়।		স্ৱ-উদ্ধৃতি 
2f6a891a9b2cd72da0cc8367d1b97e26d69ff4aaf55f3afb995fade717212092	আন্তৰ্জাতিক মহাকাশ কেন্দ্ৰটো পৃথিৱীৰ পৰা চাৰিশ কি:মি: উচ্চতাত আছে।		স্ৱ-উদ্ধৃতি 
2fdbd0bd281ece5f4cb1cc3fb3656caeb397a42a95cc8b2c69a52ca0866832b4	অসমত মীন পালনৰ প্ৰচুৰ সম্ভাবনা থকা সত্বেও অসমৰ মাছৰ উত্পাদন চাহিদা অনুসাৰে পৰ্যাপ্ত নহয়।		Assamese Wikipedia Articles
302527598114f9af3a3347b4dbb33e614608e649e67d0d4d29d4137c16b31e59	বাপুৱে স্বুলত যায়		Sentences from short Assamese stories
32039b349f8abb5791358b42b4078e36da8899de149967545e1ea9baf811f06a	 মাহাৰাজৰ আদেশ শিৰোধাৰ্য।		স্ৱ-উদ্ধৃতি
324e9c4e09bfe2754e59d5deba74fe5b4e128a119ae477d56445d9e0c7a144c4	দৈৰ্ঘ্যৰ চুটি জোখ হৈছে মিলি মিটাৰ।		স্ৱ-উদ্ধৃতি 
32c17560d77b9a1754e14e8239869b85d717f5b9708f2974a6f9d4676b927191	শগুন যদিও মাংসভোজী, তথাপি ই প্ৰাণী বধ নকৰে,মৃত প্ৰাণীহে খায়।		স্ৱ-উদ্ধৃতি স্ৱ-উদ্ধৃতি 
335fedaa3fe589acccce9a9a80e649022de4efac675e3a210de1ceab1bfc2d89	দুটা ল'ৰায়ে মদাহীটোক টনা-আঁজোৰা কৰিছিল।		স্ৱ-উদ্ধৃতি
336385058f5d40b6ce0bdf089375a2509ef3eeb5c67e61693c5c1391d7d22d6e	"  "" হব নে হ'ব"" কোনটো শব্দ শুদ্ধ?"	general	নিজৰ 
339a838030b58b51950f94eaef1c399ccbd2e5f968aeb73a2148fa3626df1244	আপুনি এতিয়াই বেগা-বেগীকৈউ  উভতি যাওঁকগৈ।		স্ৱ-উদ্ধৃতি
34ddbef1deb32993177107c1591788164322e23788ddf0a0a49d195fa029d9b8	বিছ বছৰৰ আগতে শৰৎ ডাঙৰ মানুহ হ'ব পাৰিব বুলি মই ভৱিষ্যতবাণী কৰিছিলোঁ দেখুন! 		স্ৱ-উদ্ধৃতি
34eb63b51a6ac46b6cabc97880df96d5e0805c562aa686ea78118e5ff1a03d0f	চব্বিছ ঘন্টাত পৃথিৱীত এদিন হয়, আনহাতে চন্দ্ৰৰ এদিন পৃথিৱীৰ উনত্ৰিছ দিনৰ সমান।		স্ৱ-উদ্ধৃতি 
35e1dff7dd4714fb16346d1b1a00457801a0b26904e03349e29619f05291eb2a	আচল মানে প্ৰকৃত,নকল নহয়; আৰু আঁচল মানে চাদৰৰ আগডোখৰ।		অসমীয়া অভিধান 
36afd2ee6e4b4161f11f21822fcdb75c30d15016697161c3a18f6baeabdb2790	তেখেত সকলে আমাৰো নিজ জাতলৈ তুলিলে।		Sentences from various sources
3725560f32589dbb9b7ebb1aecf8307be342c91d012b3be1f4a0118605e3e88e	ควรอ่านประโยคได้ง่าย		common voice
3761b30906221b43e2698ccf5510ca81ac4e4a25a257872dffbdc59cfc3ffeaa	মুৰৰ পৰা ভৰিলৈকে ঢাক খাই আছিল তাইৰ		Sentences from Short Assamese stories
38b09abfe575a65f15b7318202a546ad5e4fd57392b8865278406454de44425c	ট্ৰেইন-বাচ আদিতো একেই ভদ্ৰতা		Sentences from Short Assamese stories
38f6056aafa5748c81a47300fac25e5b960b91858004b3ff42f0c327935a0162	লাই পোৱা কূকুৰে ডিঙিলৈ জঁপিয়ায়।		অসমীয়া ব্যাকৰণ 
3a2619cbfde13cd03b42c26be5d17d38d0403f2b7f46b12a20477c01735c9747	বজাৰত উপলব্ধ পানীয়বোৰ স্ৱাস্থ্যৰ বাবে ক্ষতিকাৰক।		স্ৱ-উদ্ধৃতি 
3a2f39a3e8687a8e878bffbde6d00a91c9ade774fa6d56d3737f747b8994296c	నేను ఎలా ఉదహరించగలను?		common voice
3d160e28c83bdd97675a7a7ce721548684a76408101f5c6ad3064eccfb159660	প্ৰাক-শংকৰী যুগত  মাধৱ কন্দলীয়ে অসমীয়ালৈ ৰামায়ণ অনুবাদ কৰিছিল।।।		স্ৱ-উদ্ধৃতি 
40ae9a732ea7c0f0f4347892ca4a1ad4ab8d27986143b062aa5bc77b46b0364c	কিন্তু পৰ ৰাজ্যত হস্তক্ষেপ নকৰা নীতি প্ৰৱৰ্ত্তক গৱৰ্ণৰ জেনেৰেল স্যাৰ জন স্যোৰ বাহাদুৰে		???? ??????
43e7b60d4a59099af57991911ac0c0f820b1ad9f1d2c41b28654f6aec91ac08c	তুমি কি কৰিবা অভিজ্ঞতাই সেয়া নিৰ্দেশ কৰিব,অত্মবিশ্ৱাসে কামটো কৰিবলৈ তোমাক সাহস দিব।		স্ৱ-উদ্ধিতি
43f80ccd5daac5f45eed376d27f3367d608723c3beeae3bf53d4e2505d2587a8	আৰু অলপমানৰ পিছত সেই শব্দটো ঘোৰাৰ টাবৰ শব্দ যেন লাগিল।		???? ??????
44280dfe103faa79d5e2542b32eee8d62c0c7ba36c5d4e9d40cbeb596edde106	চাহ খাবলৈ চেনী নাই, তই থাউকতে দোকানৰ পৰা আনি দে-চোন।		স্ৱ-উদ্ধৃতি
452048d9da8d97bd980af842b79ad9371a6b2c11148d58dcc3fc392c5b7defe6	আজি লিখি আজি আছো চাকৰি নকৰা এজন জেষ্ঠ নাগৰিকৰ কথা।		Assamese stories.
48ba97fee9817fcbda6f658a6ec9c1585079b33f033954437811aaad145463c0	ৰাক্ষস টোৱে সোপা-সোপে গিলিব ধৰিলে।		স্ৱ-উদ্ধৃতি
48d4cb1a4411ed6f7565fcae54b88e9b9549a9bd1693be04b551a5ef70d8c82f	চকুৰ আতঁৰেই মনৰো আঁতৰ।		অসমীয়া সাহিত্য 
4a0dd414ae937c95e6af06c274fcc6093956f69661b2a6346bf4ce0c3f677c2b	ৰেলখন কামপুৰ ষ্টেচন পাওঁ পাওঁ হৈছে।		স্ৱ-উদ্ধিতি
4a7bce8b80cb9df06fa8df14386c2e996063465c6abdc4bea5752ffd64f07dfb	"""গেৰেউ-গেঁথেউ"" শব্দৰ কৰোঁ-নকৰোঁ ভাব।"		অসমীয়া অভিধান 
4aa47ab9de0a0e54227b855454f300bff6768bad712c2efe8b24e58205d21589	" ""বিশ্ৱ"" শব্দটোহে আমি অসমীয়াই উচ্চাৰণ কৰোঁ। কথাটো লক্ষ্য কৰিছে নে বাৰু?"		স্ৱ-উদ্ধৃতি 
4c90717c59cdf60bb2fcfc7cecf06b8f53a1ecac5c2fd3fc364be533da55e791	আমাৰ বাবে খাবলে' কিবা আছেনে?		Sentences from various sources
4d80a8b3fc9b42af2cf64a43194edc72c22eac57326a6f35dccf619efde55d86	আৰু বিশ্বাসঘাতকতাঅ মহাপাপৰ ফল তোক ঈশ্বৰে দিব।		???? ??????
4daa466d8037b3306d6d1fbc5c854683fb87f61b1f4dee4a6e8fdb2fdbed513a	আধুনিক চাহিদা পূৰাবলৈ মানুহে অৰণ্য ধ্বংস কৰিবি লাগিছে।		স্ৱ-উদ্ধৃতি
4ddd48fdb95257c3b65620c39a94c5f4c149ebbde88f1b3954c797d0f99c7977	অসমীয়া মানুহ বেছি উৎসৱ প্ৰিয়।		স্ৱ-উদ্ধৃতি 
4dfc3e7af70d49013219d9e8524dddaedc6a846796f9ba775e69b576a5e49043	তোমাক সিহঁতে এনেবোৰ কামত লগাই ভুচুং পহু সজাব খোজিছে যেন মোৰ ভাৱ হৈছে।		স্ৱ-উদ্ধৃতি
4e0d606c9b28b68a78ce4694c13a88d0365d8c6920b1f2bb791744bb529aa00a	ডেকা বয়সৰ পৰাই ভৱিষ্যত জীৱনৰ বাবে অলপ অলপ সঞ্চয় কৰা অভ্যাস কৰিব লাগে।		স্ৱ-উদ্ধৃতি
4e214202e4edc2254a55268928397c708b2ed740ad966c1a063f1bee7546f018	বলিউড নামেৰে পৰিচিত ভাৰতৰ হিন্দী চলচ্চিত্ৰ আৰু দূৰদৰ্শন শিল্পকেন্দ্ৰটোও এই চহৰত অবস্থিত।		Sentences from various sources.
4e82c4db253d8f521489ea5811ad8c94e575b655d748bed6fbce4c775556575d	গে’মিঙৰ বাবে আছুছ আৰঅ’জি ভাল নে লেন’ভ’ লেজিয়ন?	technology_robotics,general	স্ব-উদ্ধৃতি
4eeed21401309e918ed32cbb1d6851c3e5b1aeddb01fadfb36f6bb48d88c25b6	মোৰ ওচৰৰ ন’কিয়াৰ শ্ব’ৰুম	general,technology_robotics	স্ব-উদ্ধৃতি
4f488d262bd1e3f39165e9e9b103456b221217545ee04017b935eedd95e9bc2b	আছুছৰ শ্ব’ৰুম ক’ত আছে?	general,technology_robotics	স্ব-উদ্ধৃতি
4fabcd06242cfef7ee32e3f59fbd11a060b9543573096c752ccb3a22855b2be8	ভালে পাই ভালক, জাবৰে পাই খালক।	general,language_fundamentals	অসমীয়া জটুৱা ঠাঁচ 
4fb0c96c98325b5758ea821cfe346b859cb8abfa9a638d0ef1dcc6e387d0e6c9	???? ???? ??? ???? ???? ??? ?????? ??????? ????? ????		Alcohol and Narcotics Free Assam
501130f3fca27a7d466283faefd24e3f1ae2848bcdbcff39493b114b626835fb	  স্ৱাভাৱিক অৱস্থা	general	নিজৰ 
505feac3608cc86cec680bb24d037b46a38dd4fc41cfe0c56a57f641f195a5fa	চতুৰ, দীৰ্ঘদৰ্শী বৰফুকনে হৰদত্ত বাঘক বধ কৰিবলৈ সূৰ্য্যাস্ত্ৰ গোটাই ললো বুলিহে ভাবিলে।		???? ??????
50a698ff6b5ded599673420ba5c18b838d3384ab7ea6019d1a4166b307ccc912	"""গঁড়"" মানে কাজিৰঙাত থকা খ্ড়গ থকা জন্তুবিধ ; আৰু ""গড়"" মানে ওখ প্ৰাচীৰ বা দুৰ্গ।"		স্ৱ-উদ্ধৃতি 
513b5213dc5c9e6a1fea235055b80caaef3316fcfc226c40f270d132f57d4251	ছাত্ৰ-ছাত্ৰীৰ বাবে মাইক্ৰ’ছফ্ট ছাৰ্ফে’চ লেপটপ	general,technology_robotics	স্ব-উদ্ধৃতি
51604e0c21e92892d84874606a790053c663ada31b80089f895d1f21489d91b3	গৰুয়ে জেউৰা ভাঙি গোটেই বাৰীখন থানথান কৰি পেলালে।		স্ৱ-উদ্ধৃতি
51aecc5529622d2778dac14258edf06cb6118c841b3a45c555a15a252b086664	আৰু অলপমান যাওঁক দে।		স্ৱ-উদ্ধৃতি
51df405c8e2e87ec417e69f6f23145feb99f2b5e8148e296bef7734c7d5985b0	এই চনৰ শ্ৰেষ্ঠ স্মাৰ্টফ’ন	general,technology_robotics	স্ব-উদ্ধৃতি
51fd1ba0d68b10f74aeb95efb07b330cc7d9a20fca37ae0d9a1d77365fe79917	তাতে মই ভাত-আঞ্জা বাটিয়ে বাটিয় বান্ধি দিওঁ, তুমি নি নি খাই থাকা।		Assamese stories
520684e16db95048fd2c529ca568218a0a592bf618b7164898e0e3d54b815e82	এদা বেপাৰীটোৰ কিন্তু মনৰ পৰা বেজাৰ নগ'ল য জালুক বেপাৰী তাৰ কান্ধত উঠিল।		Assamese Novels
52d13b1281d4100318ca835934c719a854a187d1e593682ecab9ca65d3e3bdf9	শূণ্য আকাশলৈ তধা লাগি কি চাই আছা ?		স্ৱ-উদ্ধৃতি 
52fe75596c2c0840d715eb05b73fb9d22d186711690c07cb8614a625533fe7db	নাথিঙৰ স্মাৰ্টফ’ন	technology_robotics,general	স্ব-উদ্ধৃতি
53599c797780a766ef3ef401a1519cfb4645d4b0c01f8b4fbbab9b9d9073a55e	ৱায়াৰলেছ মাউছ	general,technology_robotics	স্ব-উদ্ধৃতি
542af57d3dd8a08e18a58a31dfd33116f1d5f6fe20d0af585f127acb9221ed7f	???? ??? ??????? ??? ???????? ??????? ?????? ?????? ????????? ???? ??????? ??? ????? ???		Alcohol and Narcotics Free Assam
542c604119f1523ba44dd10ae18286d81f35ab44d331b69081075e60d9e96f58	  ষাঁড় গৰুক তদাৰক নকৰি ইচ্ছানুসৰি ঘুৰি ফুৰিবলৈ এৰি দিয়া হয়।		স্ৱ-উদ্ধৃতি 
548f6c16ccd944f8f2503b56df5f28f985521ecfe41c68afc616660ef0d8976d	ৱানপ্লাছ ভাল নে গুগল ভাল?	technology_robotics,general	স্ব-উদ্ধৃতি
54d5f0b186aa21cade72f2f4381e8296c945622eb98f2aeb169925caea0a75f5	সেইটি মাত্ৰ ধনেৰে সিঁহতক বঞ্চিত কৰিলে সিঁহতে কি লৈ বুকু জুৰাই থাকিব?		???? ??????
554dd14f7807d6fc00d5443f2c367700a678c3e299af49f1c65bd8f640882e1b	শুভাকাংক্ষী সকলে মোৰ জন্মদিনত শুভেচ্ছা জনাইছিল।		স্ৱ-উদ্ধৃতি 
55b30db3e8c5ec6b0710d43a4ef0c844116b28583201ffc4c0b75bc8c116044d	গে’ম খেলিবলৈ সবাতোকৈ ভাল ফ’ন কোনটো?	general,technology_robotics	স্ব-উদ্ধৃতি
5625d4526961e0a7847b4e1992b0e37349d416d7fb743b5f67b0a43806434aa2	লেন’ভ’ৰ লেপটপ	technology_robotics,general	স্ব-উদ্ধৃতি
56571035a747e58d1bc12dbd5c112cb7c4fc5eb923d339a9e3a90e50f4cf85ae	গুগলৰ দোকান ক’ত আছে?	general,technology_robotics	স্ব-উদ্ধৃতি
565c77579adedcc0e5bd0068556e076c1594821197ff0d6f61438682f1686440	যতে মিৰি গাভৰু অসতী অৰ্থাৎ এটাৰে সৈতে প্ৰথমতে হাত-বাত কৰোঁতে আপত্তি নাই।		Assamese Novels
56821d0024b35208528f3cfcaff1f55b64a93eb2d515ca11b8e107379b8c0aef	আৰজিবি মাউছ	general,technology_robotics	স্ব-উদ্ধৃতি
57128a53f58c155aa37f4d4882cd4bb3c8fc7b120e73a1242be78ab625ac8015	"""গাইড গৰাকীয়ে মধুৰ হাঁহি এটিৰে ক'লে, ""ইয়াৰ তাৎপর্য্য কওঁ বাৰু।"""		Sentences from short Assamese stories
571ff0875229a82a1a66dfd1df8a0effc33d7b8266941d099c37d1d09befe357	ভালেহে জানে ভালৰ মোল।	agriculture_food	স্ৱ-উদ্ধৃতি 
574400e776a4ee85b4f0f50a7a740136e0323fe8c091951a9339b7baa3425303	এই বছৰ অপ্প’ৰ কি কি ফ’ন ওলাইছে?	technology_robotics,general	স্ব-উদ্ধৃতি
57468f649bc05e4185ff3b888bf4766dd38102c55a3fb327ae41cb4bd7c13f82	"""এই কথা দেখি কুৰ্ম্মীয়ে ""হখি তই গলি, মই নু কাৰে থাকিবি?"""		???? ??????
5763842794aa78922b0e485552eed52ca4224d571bdf59e2d7ecd27b9f1f9fc8	এই পুখুৰীটোও যে দুদিনমানতে শুকাব সেইটো ঠিক। তোমালোকৰ ভৱিষ্যতেৰ কথা ভাবিহে চিন্তা লাগিছে।		Sentences from Assamese stories
